S.No,System,Question,1,2,3,4,,Ans,Explanation
1,Blood,Spontaneous arrest of bleeding is called:,Homeostasis,Haemostasis,Coagulation of blood,Thrombosis,,2,Spontaneous arrest of bleeding by physiological process is called haemostasis. Cogulation of blood is on of its components. On other hand homeostasis means mechanism that control internal environment of a cell.
2,Blood,Clotting factor present in both plasma and serum is :,Thrombin,Factor VIII,Factor V,Factor Vll,,3,"Serum is plasma minus clotting factor ll, V and Vlll (Note: Thrombin is not clotting factor)."
3,Blood,Haemostasis is normally associated with all of the following except:,Polimerization of plasma prothrombin molecule,Blood coagulation,Vascular spasm,Formation of a platelet plug,,1,
4,Blood,what does not help to prevent blood loss after rupture of small blood vessel ?,Vasoconstriction,formation of fibrin threads,Platelet plug,Inhibition of basal myogenic tone,,4,
5,Blood,What is the first important event in haemostatis followiing servere tissue injury ?,Blood coagulation,formation of platelet haemostatic plug,Vascular spasm,Formation of thromboplastin,,3,This is due to release of serotonin (5HT) and other Vasoconstrictors (NE) from platelets. Other events follow it.
6,Blood,The feature of enzyme cascade system is :,Amplification,Activated enzymes in turn activate other inactive enzymes,Negative feedback regulation,Counter regulation,,2,"[Enzyme cascade system involes complex series of reaction in which inactive  enzymes are activted that , in turn, activate other inactive enzymes."
7,Blood,Soft soluble fibrin clot gets converted to firm clot by all of following except:,Factor lll,Factor Xlll,Calcium,Factor ll,,4,"Fibrin initially is a losse mesh of interlacing stands (soft clot). It gets coverted into a dense tight aggregate (from clot) by fector III, fector XIII and Ca2+. Factor II is prothrombin."
8,Blood,Which cation is important for conversion of fibrinogen to fibrin?,Sodium,Magnesium,Calcium,Cobalt,,4,
9,Blood,The conversion of fibrinogen in to fibrin occurs by:,Prothrombin,Thrombin,Thromboplastin,Platelets,,2,
10,Blood,Which of the following is required for the conversion of prothrombin to thrombin:,"Factors VII, X, V and Ca2+","Factors X, V and Ca2+",Factors X and V,Ca2+ only,,2,"Factors required to convert prothrombin into thrombin are: activated factor X, factor V, and  Ca2+ platelets phospholipids."
11,Blood,Stuart Prower factor is factor:,VIII,IX,X,XII,,3,Also called autoprothrombin-C.
12,Blood,A procoagulant not normally circulating in the  plasma is:,Prothrombin,Fibrinogen,Antihaemophilic factor,Factor VI,,4,"All factors (a), (b) and (c) are normally present in the plasma but in the inactive from."
13,Blood,The exact role of which of the following factor is not known?,IV,V,VI,VII,,2,
14,Blood,Laki Lorand factor is factor:,XIII,XII,XI,X,,1,Also called fibrin stabilizing factor or fibrinrase.
15,Blood,Which clotting factor is not consumed during clotting?,Fibrinogen,Prothrombin,Factor V,Factor VII,,3,"Factor VII is proconvertin or serum prothrombin convergen accelerator. It acts as a catalyst, therefore not consumed during clotting."
16,Blood,Constriction of blood vessel following injury is due to:,Anoxia,Serotonin,Endothelin,Prostacyclin,,2,
17,Blood,Vasoconstrictor agents released from the platelets following injury to vessel wall:,5 HT,Nor-Epinephrine,Prostacyclin,(a) and (b),,4,
18,Blood,Not true of temprory haemostatic plug:,It is a loose aggregation of platelets,Can be removed by anticoagulants,Seen following an injury to vessel wall,Gets converted to definitive plug by fibrin,,2,Temporary haemostatic plug cannot be removed by clinically used dosage of anticoagulants.
19,Blood,Temporary haemostatic plug gets converted to definitive plug by:,Calcium,5 HT,Fibrin,Factor II,,3,
20,Blood,Which of the following helps in bridging the fibrin in a clot and stabilizing the clot?,Factor III,Factor V,Factor VIII,Factor XIII,,4,The fundamental reaction in the clotting of blood is conversion of the soluble plasma protein fibrinogen to fibrin (an insoluble and elastic firm clot). The reactiion is catalyzed by activated factor XIII (fibrin stablizing factor) and requires Ca2+
21,Blood,In vitro coagulation is initiated by factor:,XIII,XI,X,IX,,1,In vitro coagulation is initiated by exposing the blood to electronegatively harged wettable surface such as glass. Factor XII is Hageman factor or glass factor or contact factor.
22,Blood,Factor used in the extrinsic pathway of blood coagulation is:,V,VIII,Tissue factor III,X,,3,Extrinsic pathway of clotting is triggered by injury to blood vessel wall or body tissue which causes release of tissue thromboplastin (III)
23,Blood,Which is not involved in intrinsic pathway?,Factor XII,Factor XI,Factor IX,Factor VII,,4,"Intrinsic system involve activation of inactive factor XII which in liver successively active other inactive factors XI, IX, VIII, X to form intrinsic prothrombin activator"
24,Blood,Deficiency of which factor does not cause an abnormality of intrinsic pathway,Factor VIII,Factor XI,Factor VII,Factor IX,,3,Intrinsic pathway does not involve this factor:
25,Blood,Pltelets are essential for clotting because of the following except:,Helps conversion of prothrombin to thrombin,Secrete fibrin stabilizing factor,Helps in clot retraction,Helps phagocytosis of carbon particles,,4,This platelet fuction do not help in clotting mechanism
26,Blood,"During haemostatsis, platelets affect the cogulation by all except:",Platelets adhesion to exposed endothelium,Clot retraction,Vasoconstriction,Conversion of fibrinogen to fibrin,,4,
27,Blood,Which pathway of coagulation is very fast?,Intrinsic,Extrinsic,Both are equally fast,Both pathways are required during coagulation,,2,Here casade of reactions involved are less as compared to intrinsic pathway of coagulation.
28,Blood,Prothrombin activator is formed by:,Intrinsic pahtway,Extrinsic pathway,(a) and (b) both,Thrombin,,3,Prothrombin activator is formed by two ways: extrinsic and intrinsic system resulting in formation of extrinsic or intrinsic prothrombin activator respectively:
29,Blood,Role of platelets phospholipids in blood coagulation is:,Provides a surface on which reagents are concentrated,Helps platelets adhesion,Helps platelets activation,Helps platelets aggregation,,1,
30,Blood,Extrinsic and intrinsic pathways for coagulation differs in that:,Extrinsic pathway is triggered by change in blood constituents,Intrinsic pathways proceeds more slowly,Determination of clotting time in vitro involve the extrinsic system,Intrinsic pathway is triggered by injury to body tissues.,,2,
31,Blood,Which of the following is not true?,Factor X is common to both extrinsic and intrinsic pathway,Calcium is essential for coagulation pathway,Negatively charged surface protien are required for activation of extrinsic pathway,Intrinsic pathway can occur in vitro.,,3,Activtion of intrinsic system in vitro is ought by exosing the blood to electronegatively charged wetable surface such as glass
32,Blood,"In clotting mechanism via intrinsic and extrinsic pathway, the key reaction is:",Formation of thrombin,Formation of fibrin,Formation of prothrombin activator,Conversion of factor X to its active from,,4,Because one Xa is formed clotting takes place within few second
33,Blood,"Once active from of factor  is formed, clotting takes placce withing:",Few milliseconds,Few seconds,Few minutes,5-10 minutes,,2,
34,Blood,Following blood coagulation intravascular thrombosis is prevented by all except:,Removal of activated clotting factor by liver,Reduction in supply of clotting factors,Interaction between thromboxane A2 and prostacyclin,Vascular spasm,,4,
35,Blood,Administration of aspirin in the low dosage shown to be a value in preventing myocardial infarction by:,Inhibiting platelets aggregation,Preventing platelets adhesion,Initiating platelets activation,Retracting the blood clot,,1,"Aspirin in low dosage has platelets anti-aggregation effect, It acts by inhibiting thromboxane A2 formation"
36,Blood,Calcium deficiencies do not produce coagulation disorders beause:,Only traces of calcium are required for coagulation,"If deficiency is very severe, it may produce bleeding symptoms",Calcium acts as a co-factor,All other clotting factors are intact,,1,Even if very severe calcium deficiency occurs it may produce tetany before coagulation disorder develops.
37,Blood,Thrombomodulin-I is prodused by all of the followin except:,Splanchnic circulation,Skin circulation,Cerebral circulation,Muscle circulation,,3,All endothelial cell except those in the cerebal microciculation produce throbomodulin-I a thrombin binding protein that converts throbin in to protein C activator.
38,Blood,Intravascular clotting is prevented by circulating:,Heparin,Fibrinolysin,Antithrombin C,All of the above,,4,"Local vascular factors like soothness of endothelial Iinning, presense of negatively charges particles and velocity of circulation also play impotant role in preventing intravascular clotting."
39,Blood,Blood normally does not clot in circulation beause of all following except:,Clotted blood librates certain substances which prevents further clotting,Removal of activated clotting factors from the circulation,Activation of fibrinolytic system that limits clotting,Presence of chelating agents in circulation,,4,No natural such agent is present in the circulation
40,Blood,The blood in the vessels normally does not clot because,Vitamin K antagonists are present in plasma,Thrombin has has positive feedback on plasinogen,Sodium citrate in plasma chelates calcium icon,Vascular endothelium is smooth and coated with glycocalyx,,4,"Smoothness of vascualr endothlium prevents platelets adhesion and (ii) glycocalyx repel negatively charged particles, ie the clotting factors."
41,Blood,Thrombomodulin-thrombin complex prevents clotting because:,Thrombomodulin inhibits prothrombin activator,Activates tithrombin III,Removes thrombin,Active heparin,,3,It also activates protein C which inactivates activated factors V and VIII
42,Blood,All of the following facilitate the conversion of pro-fibrinogen (plasminogen) to fibrinolysin (plasmin) except:,Tissue enzymes,Streptokinase,Urokinase,Antiplasmin,,4,All these enzymes are fibrinolytic enzymes which convert the plasminogen to plasmin. This helps enzymes are used in treatment of early myocardial infarction.
43,Blood,Human TPA (tissue plasminogen activator) used clinically in treatment of early myocardial infraction acts by:,Activation of fibrinolytic system,Stimulating heparin release from liver,Removing activated clotting factors from the circulation,Inhibiting thrombin,,1,
44,Blood,"Fibrinolytic system gets activated by all of the following conditions, except:",Voilent sudden death,Stress and strain,Glucocorticoids,Trypsin inhibitor,,4,
45,Blood,Heparin acts by inhibiting:,Active from of clotting factor VIII,Vitamin K synthesis in liver,Calcium,Action of thrombin,,4,"Heparin is a powerful anticogulant. It facilitates the action of antithrombin thereby inhibiting the active forms of clotting factors IX, X, XI and XII."
46,Blood,Which of the following has no anticoagulant property?,Antithrombin III,Heparin,Protein C,Ca2+,,4,Ca2+ helps in coagulation process
47,Blood,Anticoagulants that prevent coagulation when placed in a blood sample outside the body include all except:,Citrates,Oxalate,Heparin,Coumarins,,4,"Coumarins e.g. dicoumarol is vitamin K antagonist. Vitamin K helps in the synthesis of clotting factors II, VII, IX and X in the liver."
48,Blood,"Dicumarol therapy, decrease the plasma concentration of which of the following procogulants:",Prothrombin,Fibrinogen,Antihemophillic factor (factor VIII),Factor V,,1,Dicumrol a vitamin K antagonisin decreses hepatic formation of vitamin K dependent congulation factor.
49,Nerve & Muscle,"In body, heprain is secreted by:",Lymphocytes,Neutrophils,Basophils,RBCs,,3,Heparin is also secreted by mast cells.
50,Blood,Degranulation of which fot he following cell type mediate allergic and inflammatory reactions.,Neurophils,Monocytes,Basophils,Mast cells,,4,Mast cells contain lgE (Reagin) receptor on their surfaces and discharge their content of their granules when IgE-coated antigen binds to the receptors thus mediate allergic and inflmmatory responses.
51,Blood,Which of the following is not an anticogulant?,Sodium oxalate,Ammonium citrate,Sodium edetate,Vitamin K,,4,
52,Blood,Vitamin K dependent blood factors are all except:,V,VIII,IX,X,,1,
53,Blood,Citrate is anticogulant because it depletes:,Vitamin K,Prothrombin,Ca2+,Protein C,,3,
54,Blood,Snake bite may cause death by:,Destruction of fibrinogen,Stimulation of fibrinolytic system,(a) and (b) both,Tetanus,,3,These effects are seen in vivo. In vitro snake venom has a direct anticoagulant effect on fibrinogen by forming imperfect fibrin polymer
55,Blood,"Ice applied to the body surface for arresting haemorrhage, prevents bleeding by:",Activating cocagulation,Inhibiting firinolytic system,Activating platlets aggregation,None of the above,,4,Ice may prevent bleeding by its reflex vasoconstrictor effect and helps to postone clotting.
56,Blood,Parahemophilia is due to  deficiency of:,Factor I,Factor V,Factor VIII,Factor IX,,2,Parahemophilia is a congenital disorder due to deficiency of labile factor (factor V)
57,Blood,Hemophilia A is caused by deficiency of clotting factor:,Platelets fector 3,Factor V,Thromboplastin,Factor VIII,,2,Factor VIII is also called antihemophilic factor A (AHF-A) or antihemophilic globulin (AHG)
58,Blood,Hemophilia B results due to lack of which of the following factors of coagulation?,Factor V,Factor VIII,Factor IX,Factor X,,3,Factor IX is also called christmas factor of AHB-B. Its deficiency produce  christmas disease or hemophilia B.
59,Blood,Haemophilia is:,Autosomal dominant,Autosomal recessive,X-linked recessive,X-linked dominant,,3,"Hemophilia is an inherited sex linked anamoly due to an abnormal gene on X-cgriisine. In the presence of another X-chromosome the gene act as a recessive i.e., individual has no sign of hemophilia bu can transmit the desease."
60,Blood,Father to son inheritance is never seen in case of:,Autosomal dominant inheritance,Autosomal recessive inheritance,X-linked recessive inheritance,Multifactorial inheritance,,3,"Chromosomes which is transferred from father to son is only Y, therefore, all diseases which are parent on X-chromosome whether dominant or recessive cannot be transferred to son by father."
61,Blood,Activity of factor VIII procoagulantis deficient in:,Haemophilia,Von Willibrand's disease,I.T.P.,Sickle cell anaemia,,1,
62,Blood,Lack of Vitamin K causes deficiency of all except:,Prothrombin,Fibrinogen,Factor VII,Factor X,,2,
63,Blood,Vitamin K required for the synthesis of all clotting factors except:,VIII,IX,X,III,,4,
64,Blood,Hepatic formation of which of the following is not dependant on Vitamin K?,Fibrinogen,Prothrombin,Chritmas factor,Stuart prower factor,,1,
65,Blood,Which of the clotting factors is not formed by liver?,I,II,IV,IX,,1,"Factor IV is Ca2+, which is obtained frm the diet directly."
66,Blood,"In purpura, which is not seen:",Platlets count may be low,Capillary contractility is defective,CT is normal but BT increases,Deficiency of vitamin K,,4,Pupura is a clinical condition in which the capillary abnormality results in bleed-ing. It is characterised by prolongation of bleeding time (BT) and get recipitated by low platelet count.
67,Blood,Primary purpurais:,Congenital disorder,Due to allergies,Clotting time is prolonged,Capillaries re normal,,1,Also called as idiopathic purpura and usally occurs in children
68,Blood,"Secondary purpuar , false statement is:",Also called as symptomatic purpura,Capilliaries are anatomically normal,Capillaries do not contract effective-ly in responsive to injury,Platelets count is very low,,4,"Secondary pupura is due to some underying cause such as allergies, infections etc‰Û_"
69,Blood,Bleeding in thrombocytopenic purpura usually occurs when platelet count is reduced below:,1.5 lac/åµL,"75,000/åµL","50,000/åµL","25,000/åµL",,3,"Thrombocytopenic pupura is associated with low platlet count, usally <50,000 per. It results in poor clot retraction."
70,Blood,Differentiation/recognition of blood groups is based on :,Agglutinin,Agglutinogen,(a) and (b) both,IgM,,2,
71,Blood,The least frequent blood group in India is:,A,B,AB,O,,1,
72,Blood,Agglutination is :,Also referred as rouleaux formtion,Reversible process,Clumping of RBCs,RBCs pile one over another,,3,
73,Blood,Fasle regarding blood group specific substance 'O':,Does not normally act as an agglutinogen,Has no corresponding agglutinin,Helps in recognition of blood group of an individual,Least frequent blood group,,4,
74,Blood,Blood group 'O' RBCs are agglutinated by:,Agglutinin ÌÊ,Agglutinin ÌÙ,Both by ÌÊ and ÌÙ,Neither by ÌÊ nor ÌÙ,,4,
75,Blood,Agglutinin a and b are globulin of :,IgG type,IgA type,Igm type,IgD type,,3,
76,Blood,Full  description of four classical 'ABO' blood group is :,AÌÊ; BÌÙ; AbÌÊÌÙ; O,AÌÙ; BÌÊ; AB; OÌÊÌÙ,AÌÊ; BÌÙ; AbÌÊÌÙ; O,AÌÙ; BÌÊ; AbÌÊÌÙ; O,,2,
77,Blood,"In a person with type O blood, what type or types of agglutinins does he have in plasma?",None,Alpha,Beta,Alpha and beta,,2,
78,Blood,Classical 'ABO' blood groups agglutinogen first appear:,In the 6th week of foetal life,At birth,1 year of life,10 years of life,,1,
79,Blood,"Although more than 30 blood groups have been identified,the ABO blood group system remains the most important in clinical medicine because:",It was the first blood group system to be discovered.,"It has four different blood groups: A, B, AB and O",ABO antigens are present  in most body tissues and fluids.,ABO antigens are invariably present in plasma when persons RBCs lack the corresponding antigen.,,4,
80,Blood,Blood group antigens are:,Carried by sex chromosomes,Attached to plasma proteis,Attached to haemoglobin molecule,Found in saliva,,4,
81,Blood,ABO antigens are not found in,CSF,Semen,Amniotic fluid,saliva,,1,
82,Blood,"With respect to blood groups, maximum titre of agglutinin is usually reached:",At birth,1-3 years of age,4-7 years of age,8-10 years of age,,4,
83,Blood,True about cold antibodies:,Act best at low temperature between 20å¡C to 37å¡ C,Act against undiluted RBCs,Are globulin of IgM type,Can cross the placenta readily,,3,
84,Blood,"If a person has 'B' blood group, all are true except:",He may have genotype 'B',His father could have blood group 'O',His children will have either 'B' or 'O' group,And his wife also has blood group 'B' all their children will have blood group 'B' or 'O',,1,
85,Blood,Rhesus blood group was discovered by:,Karl Landsteiner,Frank and Starling,Landsteiner and Weiner,W.E. Canon,,3,
86,Blood,Rh negative individuals are those:,Whose serum contains no Rh antibody,Whose RBCs contain antigen D,With absence of Rh antigen on their RBCs membrane and their serum also contains no Rh antibody,In whom production of anti-D antibodies can be provoked by other blood groups,,3,
87,Blood,Rh negative percentage of individuals in india is:,5%,15%,42%,85%,,1,
88,Blood,Regarding warm antibodies false statement is:,Are of lgG type,Act best at body pemperature,Can cross the placenta,Examples are:  ÌÊ and ÌÙ agglutinin,,4,
89,Blood,The Rh antigen is :,A,B,C,D,,4,
90,Blood,True about RH factor:,Has no naturally occuring antibody,Seen only in humans,Not important for blood transfusion,Discovered by Karl Landsteiner,,1,
91,Blood,Rh factor is :,IgM antibody,Mucopolysaccharide,IgG antibody,Fatty acid,,2,
92,Blood,The absence of anti-A and anti-Rh agglutinins in plasma means the subject is:,A-positive,A-negative,AB-positive,Any of the above,,4,
93,Blood,Absence of anti-A and anti-Rh agglutinin in the plasma means that subject is:,A-positive or AB-positive,A-negative or AB-negative,"A-positive, AB-positive, A-negative or AB-negative",Type O-positive,,2,
94,Blood,Minimum amount of Rh positive blood required for transfusion to provoke Rh-anti-bodiesi n a Rh negative individual is ml:,0.5ml,10,50,100,,1,
95,Blood,which one of the following represents the most potenially dangerous situation?,Rh-positive mother with 2nd Rh-negative child,Rh-negative mother with 2nd Rh-positive child,Rh-positive mother with 1st Rh-negative child,Rh-negative mother with 1st Rh-positive child,,2,
96,Blood,"Rh-negative mother carrying Rh-positive foetus, first child born is usually normal because:",Mother does not have agglutinogen D,Anti-Rh titre developed is not sufficiently high to destroy the foetal RBCs,Foetal agglutinogen D cannot cross the placenta,Anti-Rh titre developed in the mother's plasma cannot cross the placenta to destroy the foetal RBCs,,2,
97,Blood,"In most instances of erythroblastosis foetalis, a feature not seen is :",The foetus is Rh-positive,The mother is Rh-negative,Many of the foetal red blood cell are nucleated,First child born is usually affected,,4,
98,Blood,Prevention of  erythroblastosis in Rh-positive babies with the Rh-negative mother is by:,Passive immunizing the mother against Rh-positive  factor soon after child birth,Above immunization to be carried out during the pregnancy,Destruction of Rh-positive cells in foetus by anti-Rh antibodies,Fresh blood transfusion to the baby immediately after birth,,1,
99,Blood,A baby with erythroblastosis foetalis can safely by given exchange transfusion with blood group:,Rh-positive,Rh-negative,O' Rh-negative,O' Rh positive,,2,
100,Blood,In cross-matching before blood transfusion:,Donor's RBCs are mixed with recipient plasma,Donor's RBCs are mixed with recipient RBCs,Donor's plasma is mixed with recipient RBCs,Donor's plasma is mixed with recipient plasma,,1,
101,Blood,"An A-negative person with high titre of anti-Rh antibodies is to be given whole blood transfusion, which of the following is most important as a precaution?",check for agglutination of person's RBCs in donor's plasma,check for agglutination of person's plasma with donor's RBCs,Direct cross-matching of blood,check for agglutination of person's RBCs with donor RBCs,,3,
102,Blood,In emergency blood transfusion of patient should be with:,RBCs corresponding to the red cell group and colloid/ crystalloid,Whole blood group corresponding to the plasma group,O' negative RBCs,AB negative whole blood.,,3,
103,Blood,Commonly seen earliest sign of blood transfusion reaction is:,Jaundice,Haemoglobinuria,Voilent pain in the back or elsewhere,Skin rashes,,3,
104,Blood,transfusion reaction may lead to all except:,Fever,Uremia,Oliguria or anuria,Leucopenia,,4,
105,Blood,Death usually occurs if more than ‰Û_.ml of incompatible blood is transfused:,50ml,150ml,250ml,350ml,,1,
106,Blood,Massive transfusion with citrated blood may result in:,Kidney failure,Tetany,Alkalosis,Hypothermia,,2,
107,Blood,A man blood group B cannot be the biological father of a child with an AB blood type if:,The mother is type O,The mother is type A,The mother is type AB,The mother is Rh-positive,,1,
108,Blood,Addition of glucose to stored blood is to:,Prevents hemolysis,Provides nutrition,Increases haemoglobin content,Decreases the PH,,4,
109,Blood,"""Fresh"" blood refers to blood which is administered:",Immediately,Within 12 hours,Within 24 hours,Within 72 hours,,3,
110,Blood,Major loss of RBCs in stored blood occurs in:,First 24 hours,48-72 hours,3-7 days,14-21 days,,1,
111,Blood,Storage of blood beyond 7 days shows all except:,Increase in prothrombin time,Decrease in glucose,Increase in lactic acid,Decrease plasma [K+],,4,
112,Blood,Stored blood as compared to fresh blood has,"More 2, 3 DPG",High extracellular K+,High extracellular haemoglobin,Increase platelets.,,2,
113,Blood,Mean life of RBCs in transfused blood is ‰Û_....days:,120,100,60,14,,3,
114,Blood,Half-life of transfused  platelets is:,4 hours,12 hours,8 days,15 days,,2,
115,Blood,Which one of the following changes would not occur in blood after 7 days of storage?,Decreased concentration of dextrose and increased concentration of lactic acid,Decreased concentration of plasma potassium,An increased prothrombin time,Decreased concentration of platelets,,2,
116,Blood,Which of the following shows little change in stored blood?,Na+,K+,Lactic acid,Ammonia,,1,
117,Blood,All type of immune response are fundamentally mediated by:,Tissue macrophages,Lymphoid tissues,Lymphocytes,Plasma cells,,2,
118,Blood,Lymphoid tissues contain all except:,T and B lymphocytes,Lymphocytes which are processed in the thymus,Responds to antigen by relealing either sensitized Iymphocytes or antibodies or both,Polymorphonuclear leucocytes,,4,
119,Blood,Which is not true about tissue macrophage system?,Previously called as reticulo-endothelial system,It consists of special group of phagocyte cells,It is found in different part of the body having common characteristic features,Lymphoid tissues form  a part of this system,,4,
120,Blood,Which is not a function of tissue macrophage system?,All blood cells get destroyed here,Concerned with the defence of the body against infection,Capable of phagocytosing large foreign colloidal particles,Forms and secretes antibodies,,4,
121,Blood,"The function common to neurophils, monocyte and macrophage is",Immune response,Phagocytosis,Liberation of histamin,Destruction of old erythrocytes,,2,
122,Blood,Reticule-endothelial system derived from monocytes include all of following except:,Kupffer' cell,Alveolar macrophages,Macrophages of spleen and bone marrow,Natural killer cells,,4,
123,Blood,Immune complexes are removed from blood by:,B-cell,Basophil,Plasma cells,Kupffer cell,,4,
124,Blood,Macrophages are the mature form of :,Basophils,Eosinophils,Lymphocytes,Monocytes,,4,
125,Blood,What type of cells found in lymph nodes phagocytizes unwanted particles?,Basophils,Lymphocytes,Plasma cells,Macrophages,,4,
