S.No,System,Question,1,2,3,4,,Ans,Explanation
3783,Nervous system,Which part of a motor neuron has the lowest threshold for a propagated action potential?,Axon,Axon hillock,Soma,Dendrite,,1,
3784,Nervous system,Post-synaptic inhibiiton in the spinal cord during the course of an IPSP is called:,Direct inhibition,Indirect inhibition,Renshaw cell inhibition,Negative feedback inhibition,,1,
3785,Nervous system,Reflex contraction of a sleletal muscle in response to its stretching is an example of:,Post-synaptic inhibition,Direct inhibition,Afferent inhibition,All of the above,,4,
3786,Nervous system,Golgi bottle neuron:,An inhibitory interneuron  in the spinal cord,Located in the anterior horn of the spinal cord,When activated liberates glycine at its endings,All of the above,,4,
3787,Nervous system,Pathway for direct inhibition is:,Monosynaptic,Disynaptic,Trisynaptic,Variable,,2,
3788,Nervous system,Post -synapic inhibition occurs:,When post-synaptic cell has just fired and is in its refractory period,During after-hyperpolarization state of post-synaptic cell,When neurons may inhibit themselves in a negative feedback fashion,All of the above are true,,4,
3789,Nervous system,Renshaw cell inhibition is a typical example of:,Presynaptic inhibition,Direct inhibition,Recurrent inhibition,Afferent inhibition,,3,
3790,Nervous system,Not true of Renshaw cells:,Liberate an inhibitory transmitter,Are short axon neurons lying  in the grey matter,Stimulated by acetycholine,Inhibits themselves in a negative feedback fashion,,4,
3791,Nervous system,Renshaw cell inhibition is:,An example of lateral inhibition,Involves an interneuron in its reflex act,Exerted entirely as presynaptic inhibition,An example of positive feedback,,2,
3792,Nervous system,Which of the following transmitter substance almost always tend to inhibit the post-synaptic neuron?,Gamma aminobutyric acid (GABA),Dopamine,Glycine,Norepinephrine,,1,
3793,Nervous system,Inhibition of the spinal cord may be brought about by:,Glutamic acid,Aspartic acid,Glycine,Strychinine,,3,
3794,Nervous system,Neurotransmitter responsible for presynaptic inhibition is:,Glycine,Glutamic acid,Serotonine,GABA,,4,
3795,Nervous system,Which is true about presynaptic inhibition,Occurs due to hyperpolarization of presynaptic membrane,Occus due to inhibition of relaese of positive neurotransmitter from presynaptic terminal,Produces action potential,Occurs due to blockage of presynaptic receptor,,1,
3796,Nervous system,"Gamma-amino butyric acid (GABA), a major inhiitory transmitter in the CNS acts by:",Increasing the permeability of neuron to K+,Increasing the permeability of a neuron to Na+,Increasing the permeability of the cell to Ca2+,Decreasing the permeability of the cell to Ca2+,,1,
3797,Nervous system,Neurotransmitter responsible for presynaptic inhibition is:,Serotonin,Acetylcholine,Glutamic acid,Glycine,,1,
3798,Nervous system,Strychine acts by:,Exciting all excitatory synapse in the spinal cord,Blocking inhibitory synapses,Being incorporated as substitute transmitter in monoaminoergic synapse,Directly exciting the skeletal muscle fibres,,2,
3799,Nervous system,Presynaptic  inhibition can be greatly pronounced by:,Convulsant drugs,picrotoxin,Barbiturates,Strychinine,,3,
3800,Nervous system,Which of the following statement is true regarding the change in ionic current causing the event.,End plate potential and increase in Na+ permeability,Inhibitory of post synaptic potantial (IPSP) and closure of CI- channels,Excitatory of post synaptic potantial (EPSP) and opening of K+ channels,Presynaptic inhibition and closure of K+ channels,,1,
3801,Nervous system,Not a property at the synapse:,All or none law,Low of forward conduction,Fatigue occurs at synapse,More susceptible to hypoxia than nerve fibers,,1,
3802,Nervous system,"In spinal reflex, following are seen except:",Latency,Fatiguebility,Summation,Memory,,4,This is not a property at the synapse
3803,Nervous system,The minimal synaptic delay is:,0.1 msec,0.5 msec,1.0 msec,5.0 msec,,2,
3804,Nervous system,Occlusion at synapse occurs due to:,Increased excitability of post-synaptic neurons,Synaptic delay phenomenon,Afferent fibers overlapping in their central distribution,Release of inhibitory transmitter,,3,
3805,Nervous system,Post-tetanic potentiation:,Lasts for days,Is increased post-synaptic potentials in response to stimulation,Is due to increased intracellular Ca2+ in post-sypantic neurons,Also called presynaptic facilitation,,2,
3806,Nervous system,Which of the following is not involved in production of long term potentiation (LTP):,Ca2+,NDMA receptors,Membrane hyperpolarization,Membrane depolarization,,3,
3807,Nervous system,Sensory receptors false is:,Are specialized modified sensory nerve endings,Acts as a transducer,Get activated in response to a specific stimulus,Under goes hyperpolarization on stimulation,,4,
3808,Nervous system,What modality sensation is detected by free nerve endings?,Crude tocuh,Pain,Thermal sensations,All of the above,,4,
3809,Nervous system,Stimulus for photoreceptors is:,Mechanical,Chemical,Noxious,Electromagnetic,,4,It refers to light
3810,Nervous system,Not true about superficial senses is:,"Their receptor are located is skin, therefore , also called cutaneous senses",Information in them is carried by cutaneous branches of spinal nerves,"Examples include : touch, pain, pressure  and thermal",Stimulus for all these senses in mechanical,,4,
3811,Nervous system,Special senses differ from superficial senses in all of the following except:,They are located at one place very close to CNS,Specialized for one type of sensory stimulation,Information from them is carried by cranial nerves,Most sensitive to adequate stimulus,,4,This is true for all sensation
3812,Nervous system,Receptors for vision are:,Telereceptors,Exteroceptors,Interoceptors,Chemoreceptors,,1,
3813,Nervous system,Meissner's corpuscles are believed to be sensitive to:,pH of interstitial fluid,Histamine,Change of temperature,Mechanical deformation,,4,
3814,Nervous system,Not a feature of tactile receptors:,They occur in groups in the skin papillae,Maximum density is seen in the skin of ganitalia and tongue,They are rapidly adapting receptors,They are sensory nerve endings of A fiber (ÌÙ and  group,,2,
3815,Nervous system,We do not feel clothes once they are put on because:,Cutaneous receptors do not respond to this stimulus,No receptors are present over the skin to sense their presence,They fail to generate  activity in any of the Cutaneous receptors,They activate the tactile receptors which are rapidly adapting receptors,,4,
3816,Nervous system,The distance by which two touch stimuli must be separated to be perceiced as two separated stimuli is greatest at:,The lips,The palm of the hand,The back of scapula,The dorsum of the hand,,3,
3817,Nervous system,Nerve ending that acts as tactile receptors is:,AÌÙ fibers,A  fibers,C fibers,All of the above,,4,
3818,Nervous system,Meisser's corpuscle:,Detects the degree of tension in the muscles,Detects the rate of change of muscles length,Detects very rapid changes in pressure,Responds specifically  to light touch,,4,
3819,Nervous system,All of the following are the example of mechanoreceptors except:,Free nerve endings,Pacinian corpuscles,Ruffini's endings,Carotid bodies,,4,
3820,Nervous system,Pacinian corpuscles are the major receptors for:,Pain,Touch,Pressure,Temperature,,3,
3821,Nervous system,Sensation perceived by pacinian corpuscles:,Cold,Warmth,Touch,Vibration,,4,
3822,Nervous system,False statement about Pacinian corpuscles:,Respond maximum to sustain touch,Are large receptors resembe an onion in shape and lamination,"Are found in large number in the skin, subcutaneous tissues and mesentery",Slowly adapting receptors,,4,
3823,Nervous system,Ruffini's end organs are:,Expanded tip endings,Laminated endings,Encapsulated spary endings,Free nerve endings,,3,
3824,Nervous system,Ruffini's end organs is mainly associated with sensation of:,Pressure,Cold,Pain,Touch,,2,
3825,Nervous system,Pain receptors are:,Meissner's corpuscles,Naked nerve endings,Merkel's discs,Pacinian corpuscles,,2,
3826,Nervous system,Nociceptive stimuli are transmitted by:,Naked nerve endings,Pacinian corpuscles,Merkel's disc,Ruffini end organ,,1,
3827,Nervous system,Kinaesthetic sensation is:,Transmitted entirely in AÌÙ type of sensory nerve fibers,Located in Markel's disc,Transmitted by Meissner's corpuscles,Means abnormal perception of sensation,,1,
3828,Nervous system,Kinaesthetic sensation are detected mainly by what type of receptors:,Muscle spindles,Golgi tendon organs,Skin receptors,Joint receptors,,4,
3829,Nervous system,Not a joint receptor:,Pacinian corpuscles,Golgi tendon organs,Ruffini's ends organs,Muscle spindle,,4,
3830,Nervous system,Which of the following receptors is correctly paired with the appropriate type of stimulus?,Ruffini's end organ and sustained pressure,Pacinian corpuscles and proprioception,Markel's dises and warmth,Meisser's corpuscles and vibration,,1,
3831,Nervous system,What causes stimulation of the thermal receptors?,Change in the membrane structure caused by temperature,Change in the metabolic rate of the nerve ending,Increased in the concentration of sodium ions outside the neuron,Change in viscosity of the fluid surrounding the neuron,,2,
3832,Nervous system,Not true statement about cold receptors:,Are unmyelinated 'C' fibers,4-10 times more than warm receptors,Respond primarily to temperature of tussues which immediately surround them,Also get activeted when tissues temperature is raised beyond 45å¡C,,1,
3833,Nervous system,Density of which thermoreceptors is more in human?,Cold receptors,Warm receptors,Both in equal amount,Variable distribution,,1,
3834,Nervous system,Cold metal objects feel colder than wooden objects of the same temperature because:,Number of cold receptors is more than warm receptors,Cold receptors are thin myelinated A fibers,Metal conducts heat away from the skin rapidly,Cold receptors have low threshold of excitation,,3,
3835,Nervous system,Paradoxical cold fiber discharge:,Occurs when warm receptors respond to raised tissue temperature,Cold receptor discharge at increasing rate when tissue temperature is raised beyond 45å¡C,So called because stimulation of cold receptors produces sensation of warmth,Produces mixed sensation of warmth and pain,,2,
3836,Nervous system,"If a single spinal nerve is cut, the area of tactile loss is always greater than the area of loss of painful sensation, because:",Tectile information is carried by myelinated fast conducting fibers,Tactile receptors adapt quickly,Degree of overlap of fibers carrying tactile sensation is much less,In the primaly sensory cortex tactile sensation is representated on a larger area,,3,
3837,Nervous system,False about receptor (or generator) potential:,A non-propagated depolarizing potential,Resemble an EPSP,Its magnitude is directly proportional to the intensity of stimulus,Obeys all or none law,,4,
3838,Nervous system,Generator potential receptor potential:,Increases in amplitude as the strength of a stimulus is increased,Always leads to an action potential,Obeys'all more' law,Has a threshold,,1,
3839,Nervous system,Source of generator potential in Pacinian corpuscle is:,Unmyelinated sensory nerve ending,receptor capsule,First node of Ranvier,Second node of Ranvier,,1,
3840,Nervous system,Weber Fechner law deals with:,Frequency discrimination,Receptive field organization,Intensity discrimination,Two point discrimination,,3,
3841,Nervous system,Not correct law of adequate stimulus refers to:,Receptors respond maximully only when an appropriate specific stimulus is applied,Receptors are adapted to respond to one particular form of energy at much lower threshold,Receptors are more sensitive to one particular stimulus,Applies to special senses only,,4,
3842,Nervous system,Phenomenon of adaptation of complete and occurs fastest in:,Pacinian corpuscles,Muscle spindles,Joint  capsule receptors,Hair base receptors,,1,
3843,Nervous system,Tonic receptors differ from phasic receptors in all except:,"Are poor, slow and incompletely adapting receptors",Generator potential is prolonged and decays slowly,"Examples include : muscle spindle, baroreceptors  and chemoreceptors",Transmit signals only when the stimulus strength is changed,,4,
3844,Nervous system,Why does stimulation of touch receptors causes a sensation of touch and not of warmth because:,Differences in the action potential in nerves,Specific part of the brain the sensation ultimately activates,Law of projection,Law of adequate stimulus,,2,
3845,Nervous system,"No matter where a particular sensory pathway is stimulated along its course to the cortex, the conscious sensation produced is referred to the location of the receptor. This is:",Law of projection,Muller's Law,Weber's Fechner law,Bell Magendie's law,,1,
3846,Nervous system,Phantom limb phenomenon can be described by:,Weber's Fechner law,Law of intensity discrimination,Bell Magendie's law,Law of projection,,4,
3847,Nervous system,Capacity to discriminate an increment in intensity of stimulus is:,Greater when amplitude of generator potential is smaller,Greater in higher range of stimulation,Greater in lower range of stimulation,Greater if duration of latent period increases,,3,
3848,Nervous system,True about Weber Fechner law:,It states that localization of two point depends on the magnitude of the stimulus,Intersity of stimulus is inversely related to the sensation felt,Dorsal columus are sensory and ventral columus are motor,Intersity of sensation felt is direclty proportional to stimulus applied by a power function,,4,
3849,Nervous system,The intensity of sensory stimuli is determined by:,Duration of latent period,Amplitude of action potential,Frequency of anction potential,Amplitude of generator potential,,3,
3850,Nervous system,As the strength of a stimulus is increased it spreads over a large area activating more and more receptors. This is called:,Specificity of response,Muller's doctrine of specific nerve energies,Recruitrment of sensory unit,Law of projection,,3,
3851,Nervous system,Weber Fechner law applies to which of the following sensation?,Cutaneous sensations,Special sensations,Deep sensations,All of the above,,4,
3852,Nervous system,Reflex:,Forms the functional unit of the nervous system,Consists of receptors only,Is an involuntary respone to a stimulus,A voluntary respone to a stimulus,,3,
3853,Nervous system,The reflex arc consists of:,Receptors,Effector organ,Afferent and efferent neuron,All of the above,,4,
3854,Nervous system,In the spinal cord the fact that dorsal roots are sensory and the ventral roots are motor is called:,Muller's Law,Bell-magendie Law,Sherrington 's Law,Starling's Law,,2,
3855,Nervous system,All are monosynaptic reflexes except:,Knee reflex,Biceps reflex,Ankle reflex,Abdominal reflex,,4,
3856,Nervous system,All of the following are superficial reflexes except:,Ankle reflex,Corneal reflex,Abdominal reflex,Babinski reflex,,1,
3857,Nervous system,Brief sudden elongation of extensor muscle of thigh caused by tapping the patellar tendon is example of:,Monosynaptic reflex,Dynamic stretch reflex,Knee reflex,All of the above,,4,
3858,Nervous system,Lowest level of integration of stretch reflex is:,Cerebrum,Cerebellum,pons,Spinal cord,,4,
3859,Nervous system,Which of the following reflexes is not a stretch reflex?,Knee reflex,Ankle reflex,Biceps reflex,Abdominal reflex,,4,
3860,Nervous system,"In human beings, reaction time for stretch reflex is ‰Û_...msec?",14-Oct,19-24,30-25,38-42,,2,
3861,Nervous system,"In monosynaptic reflexes, central delay is:",0.6-0.9 msec,1.5-2.0 msec,10-14 msec,19-24 msec,,1,
3862,Nervous system,False statement regarding stretch reflex:,Best known monosynaptic reflex in the body,Fundamental reflex to control body posture,Highly developed in antigravity muscles,Extensors of arms are antigravity muscles,,4,
3863,Nervous system,Muscle spindle is:,Receptor for a variety of multi-synaptic reflex,Receptors for stretch reflex,Occurs only in antigravity muscles,Excited by both stretch and contraction of the muscles in which it is located,,2,
3864,Nervous system,"In inter-segmental (stretch) reflex, the afferents come from:",Golgi tendon,Ia fibers,II b fibers,Muscle spindles,,4,
3865,Nervous system,Which muscles have high density of muscle spindles:,Flexer muscles,Extensor muscles,Antigravity muscles,Agonist muscles,,3,
3866,Nervous system,Not true about intrafusal fibers:,2-12 such fibers are surrounded by fliud and enclosed in a capsule forming muscle spindle,Their ends are contractile white the centre is not,Nuclear bag fiber is the only example,More embroynal in character,,3,
3867,Nervous system,Main function of primary or annulospiral endings in muscle spindle is to:,Respond to static change in length and to rate of change of elongration of recetors,Transmit the sensation of pain in the muscle to CNS,Respond to total tension imposed on the muscle but not on the rate of change of length of receptors,Respod to marked muscular tension which then results in inhibition of contraction,,1,
3868,Nervous system,Main function of nuclear bag fiber is:,Maintain muscle length,Relaxation of antagonistic muscle,Relaxation of response to strong stretch,Muscle relaxation,,1,
3869,Nervous system,The rate of change of muscle spindle (dynamic response) is sensed by:,Primary endings,Annulospiral endings,Group la fibers,All of the above,,4,
3870,Nervous system,True about nuclear bag fiber:,Detects dynamic change,Supplied by la sensory fibers,A type of intrafusal fiber,All of the above,,4,
3871,Nervous system,Muscle spindle detects:,Tension,Length,Proprioception,Stretch,,2,
3872,Nervous system,The receptor portion of the skeletal muscle is innervated by:,Group  la fiber,Group II fiber,(a) and (b) both,Group A fibers,,3,
3873,Nervous system,Which of the following situations would cause stimulation of annulospiral endings contained within muscle spindles?,Contraction of extrafusal fibers,Contraction of synergistic muscle,Contraction of intrafusal fibers,Contraction of antagonistic muscles,,3,
3874,Nervous system,What is false regarding the gamma efferent neuron?,An 'A' group motor neuron with a smaller diameter than that of alpha efferent neurons,Innervates intrafusal fibers,Innervates muscle fibers that stretch annulospiral endings,Innervate both intra and extrafusal fibers,,4,
3875,Nervous system,False statement regarding muscle spindle:,Central zone has no actin  & myosin,Peripheral zone has no actin & myosin,Type 1 nuclear bag fibers has low myosin ATPase activity,Type 2 nuclear bag fibers has high level of  myosin ATPase activity,,2,
3876,Nervous system,Length servo mechanism:,A system of negative feedback device,It operate to maintain muslce tension,Acts to regulate posture at rest,Causes sustained contraction of the muscle,,1,
3877,Nervous system,Gamma motor neurons innervate:,Extrafusal muscle fibers,Intrafusal muscle fibers,Primary motor interneurons to skeletal fibers,Inhibit antagonistic muscles,,2,
3878,Nervous system,Increased Y-motor neuron discharge results in:,Increased spindle sensitivity,Decreased spindle sensitivity,No effect on spindle sensitivity,Variable,,1,
3879,Nervous system,The brain area that facilitates the stretch reflex:,Motor cortex,Basal ganglia,Cerebellum,Vestibular necleus,,4,
3880,Nervous system,Increased gamma efferent discharge is seen in all except:,Jendrassik's manouvre,Anxiety,Rapid shallow breathing,Stimulation of skin,,3,
3881,Nervous system,Stretch reflex becomes hypoactive by all  the following except:,Deafferentation,Unexpected movements,Hypothyroidism,Hypoxia,,2,
3882,Nervous system,Not true about muscle tone:,It is the tension present in the resting muscle,It is due to low frequency ÌÊ-motor neurons discharge,It is a state of portial tetanus,It depends on the stretch reflex,,2,
3883,Nervous system,Not a cause of hypotonia:,During sleep,Tranquilizer overdose,Anxiety,Tabes dorsalis,,3,
3884,Nervous system,What ensures the movement of the agonist muscle is not obstructed by contraction of the antagonist muscle:,Inverse stretch reflex,Reciprocal innervation,Autogenic inhibition,Clasp knife effect,,2,
3885,Nervous system,The average number of muscle fibers attached to one golgi tendon organ are:,01-Mar,25-Mar,25-50,50-75,,2,
3886,Nervous system,Golgi tendon reflex to reflex muscle is:,Monosynaptic involving medulla,Monosynaptic involving spinal cord,Polysynaptic involving spinal cord,Polysynaptic involving medulla,,3,
3887,Nervous system,The Golgi tendon oragn differs in function from annulospiral ending in that the tendon organ:,Is more sensitive to distending force,Cause reflex inhibition of ipsilateral antagonistic alpha motor neurons,Causes a reflex inhibition homonymous alpha motor neurons,Cause reflex stimulation of both ipsilateral & antagonist muscles,,3,
3888,Nervous system,The Golgi tendon oragn sense:,Muscle length,Rate of change of Muscle length,Tendon tension,Both (a) and (b),,3,
3889,Nervous system,Golgi tendon reflex is meant for:,To facilitate muscle tension,To limit muscle tension,To stimulate muscle contraction,To maintian muscle length,,2,
3890,Nervous system,The inverse stretch reflex not a correct statement:,Also called autogenic inhibition,A protective reflex,An example of indirect inhibition,Pathway mediating this response is bisynaptic,,3,
3891,Nervous system,Lengthening reaction:,Muscle is contracted further as the tendon is elongated,Increased activity of Golgi tendon organ stimulate inter-nuncial cellsin spinal cord and further stimulate ÌÊ-motor neurons,Contraction muscle fibers are suddenly relaxed through inhibiiton of ÌÊ-motor neurons,There is lengthening of muscle and tendon in response to a superasegmentarl inhibiiton of Y-motor neurons,,3,
3892,Nervous system,What can be the most likely mechanism responsible for the abrupt cessation of sleletal muscle contraction in a normal subject attempting to lift a heavy load?,Activation of stretch receptors in Golgi tendon organ,Activation of stretch receptors in annulospiral endings,Skeletal muscle ischaemia,Inactivation of stretch receptors in Golgi tendon organ,,1,
3893,Nervous system,The neuronal circuit with the greatest potential for producing a long-lasting output is the:,Diverging circuit with multiple inputs,Converging circuit with multiple outputs,Reverberating circuit,Intergative circuit,,3,
3894,Nervous system,Withdrawal reflex:,Is more rapid than stretch reflex,Is antigravitational,Is polysynaptic,Does not appear if spinal cord is separeted from supra-segmental level,,3,
3895,Nervous system,Withdrawal reflexes are not,Prepotent,Initiated by noxious stimuli,prolonged if the stimulus is strong,An example of extensor reflex,,4,
3896,Nervous system,After discharge is of greatest extent in case of:,Stretch reflex,Withdrawal flexor reflex,Crossed extensor reflex,Philliipson's reflex,,3,
3897,Nervous system,Crossed extensor reflex is:,Withdrawal reflex,Postural reflex,Monosynaptic reflex,Sympathetic reflex,,1,
3898,Nervous system,Flexor reflex elicited by a strong noxious stimulus is characterized by:,Local sign,Prolonged after discharge,Central excitatory state,Central inhibitory state,,2,
3899,Nervous system,Which of the following is an autonomic reflex?,Mass reflex,Withdrawal flexor reflex,Cross extensor reflex,Stretch reflex,,1,
3900,Nervous system,Polysynaptic reflexs differ from monosynaptic reflexes in that:,Basically protective reflexes,Characterized by reciprocal innervation,Show integration at the level of ÌÊ-motor neurons,Show after discharge and irradiaton of impulses,,4,
3901,Nervous system,Sensory System consists of:,Sensory receptors,Neural pathways,Somatosensory cortex,All of the above,,4,
3902,Nervous system,Perception refer to:,Relay of  sensory information to cerebral cortex,Understanding of sensation's meaning,Receptors that receive stimuli,Receiving information,,2,
3903,Nervous system,"The area of skin or body surface that, when stimulated, leads to activity in the neuron s called:",Sensory unit,Sensory receptors,Receptive field,Field of sensation,,3,
3904,Nervous system,Specific ascending pathways:,Its neurons can be activated by several different types of stmuli,Single only genaral information,Carry information about single types of stimuli,Feed informations into cortex that are not highly discriminative,,3,
3905,Nervous system,The ascending pathways that have significant lateral inhibition are utilized for providing :,Accurate localization of sensation,Intensity discrimination,Specificity of response,Increased receptive field,,1,
3906,Nervous system,"Somatosensory cortex, lies in the:",Frontal lobe,Parietal lobe,Temporal lobe,Occipital lobe,,2,
3907,Nervous system,Sensory tract not contained within the lateral white column of spinal cord:,Lateral spinothalamic tract,Posterior spinocerebellar tract,Anterior spinocerebellar tract,Anterior spinothalamic tract,,4,
3908,Nervous system,Somato sensory vibratory information reaches the brain through:,Dorsal columns of spinal cord,Lateral spinothalamic tract,Anterior spinothalamic tract,Dorsal spinocerebellar tract,,1,
3909,Nervous system,Nucleus gracilis and nucleus cuneatus are the first synapse for:,Dorsal columns,Dorsal lateral tract,Ventral spinothalamic tract,Lateral spinothalamic tract,,1,
3910,Nervous system,The somasthetic  sensation relay in which part of the thalamus?,Ventro lateral nucleus,Ventro posterior nucleus,Anterior nucleus,Pulvinar,,2,
3911,Nervous system,Unconscious Kinesthetic sensation are carried by:,Anterior spinocerebellar tract,Anterior spinothalamic tract,Lateral spinothalamic tract,Posterior columns,,1,
3912,Nervous system,Sexual sensation ascend to the brain through the:,Spinothalamic tract,Anterior spinocerebellar tract,Anterior spinocerebellar tract,Dorsal columns,,1,
