S.No,System,Question,1,2,3,4,,Ans,Explanation
1296,CVS,Local autoregulatory mechanisms in CVS:,Are chemical and neural types,Include vasoactive substance like prostaglandins and nitric oxide,Operate along with other mechanisms to adjust vascular responses throughout the body,Operate to maintain blood flow through an organ at relatively constant level,,4,
1297,CVS,"Autoregulation phenomenon, false statement is:",Refer to the capacity of tissue regulate theirown bloood flow despite fluctuations in perfusion pressure,Is seen in all vital organ of the body,Is brought about by the presence of basel myogenic tone in the blood vessels of the body organs,Is seen in kideny only,,4,
1298,CVS,Autoregulation of blood flow is not seen in:,Liver,Skeletal muscle,Kidneys,Skin,,4,
1299,CVS,Which of the following is true regarding autoregulation of blood flow?,Vary with change in pressure,Maintains the blood flow,Well developed in skin,Regulated by local metabolities,,2,
1300,CVS,Blood vessels which do not show basal myogenic tone include:,Arterioles,Metarterioles,Precapillary sphincters,Capillaries,,4,Capillaries patency is under Precapillary sphincters]
1301,CVS,Blood flow is largely regulated by local metabolic effects in:,Liver,Brain,Kidney,Skeletal muscle,,4,
1302,CVS,Which of these mediate the precapillary sphincter relaxation:,Local hormones,Sympathetic stimulation,Catcholamines,Capillary filling,,1,
1303,CVS,Arterioles exhibits myogenic activity which is:,Poorly synchronized,Asynchronized,Well synchronized,Do not show myogenic activity,,3,
1304,CVS,Normal precapillary to post-capillay resistance ratio is:,1 : 4-5,4-5 : 1,1:03,3:01,,2,
1305,CVS,Which of the following cause vasodilation:,Mg2+,Ca2+,K+,Acidemia,,4,
1306,CVS,All of the following metabolite are responsible to produce local vasodilatation of the blood vessles except:,Lactic acid,Adenosine,Serotonin,Hyperkalemia,,3,[ Serotonin is a local vasoconstrictor agent.]
1307,CVS,Which of the following does not dialate arterioles in the skin?,Increased body temperature,Epinephrine,Substance P,ADH,,4,
1308,CVS,The vasodilatation produced by carbon dioxide is maximum in one of the following:,Kidney,Brain,Liver,Heart,,2,
1309,CVS,K+ specially produce vasodilatation in:,Cardiac muscle,Skin,Brain,Skeletal muscle,,4,
1310,CVS,Endothelial cells synthesize:,Fibrinogen,Nitric acid,Substance P,Serotonin,,2,
1311,CVS,Endothelial cells synthesize all except:,Nitric oxide,Prostaglandins,Vascular endothelial growth factor,Factor X,,4,
1312,CVS,Which of the following is not a function of nitric oxide:,Kill cancer cells,Vasocontriction,Relaxation of vascular smooth muscle,Deficiency may cause clinical hypertension,,2,
1313,CVS,Nitric oxide in GIT acts primarily by:,Smooth muscle relaxant,Secretomotor,Vasodilator,Vasocontriction,,1,
1314,CVS,Regarding nitric oxide false is:,Derived from endothelium,Acts by increasing c-AMP levels,Vasodilator,Derived from arginine,,2,[It acts through cGMP as the second messenger.]
1315,CVS,All of the following are the action of Endothelial except:,Contracts vascular smooth muscles,Increases heart rate and force of contraction of myocardium,Produces bronchoconstriction,Increases GFR,,4,
1316,CVS,All of the following statements are true with respect to kinins action in the body except:,They produce contriction of all types of smooth muscles of the body,They produce increase vascular permeability by action on venules,"In high doses, promotes the migration of leucocytes from blood to tissue",Stimulate the sensory nerve endings producing pain,,1,
1317,CVS,Which of the following statement about Bradykinin is true:,Causes pain,Causes bronchodilation,Causes vasoconstriction,Decrease vascular permeability,,1,
1318,CVS,"Inflammation is characterized by all, except:",Increase in vascular permeability,Local pain,Constriction of vascular smooth muscles,Accumulation of leucocytes at the site of injury,,3,
1319,CVS,Increased peripheral vascular resistance is caused by:,Discharge of sympathetic cholinergic fibers,Histamine,Lactic acid,Angiotensin II,,4,
1320,CVS,Most potent vasopressor is:,Angiotensin II,Renin,Aldosterone,Cortisol,,1,
1321,CVS,Most potent circulating vasoconstrictor is:,Epinephrine,Nor-epinephrine,Angiotensin II,Serotonin,,1,
1322,CVS,Sympathetic stimulation of heart causes all except:,Increased coronary blood fow,Increased excitability of heart,Increased force of myocandial contraction,Decreased rate of SA node,,4,
1323,CVS,A stronger than normal heart might be observed during:,Sympathetic stimulation,Myocardial ischemia,Stokes-Adams syndrome,Atral fibrillation,,1,
1324,CVS,Increased conductivity in conduction tissue is termed as:,Positive chronotropic action,Positive inotropic action,Positive dromotropic action,Positive bathmotropic action,,3,
1325,CVS,The portion of the mammalian heart which is not innervated by vagus nerve is:,SA node,AV node,Muscles of the atria,Muscles of the ventricles,,4,[No vagal motor fibers are distributed to the ventricles.]
1326,CVS,Parasympathetic stimulation would decreased the following except:,Ventricular contractility,Heart rate,A.V. conduction time,Atrial contractility,,1,
1327,CVS,Which one of the following effects in the heart would not be a result of increased vagal nerve activity?,Acetylcholine release at the nerve endings,Decreased S-T interval,Bradycardia,Hyperpolarization of the S-A node,,2,[ As  'ST' interval represnts ventricular repolarization.]
1328,CVS,Parasympathetic system affects CVS mainly by altering:,Vascular resistance,Vascular compliance,Force of contraction of ventricles,Heart rate,,4,
1329,CVS,"At rest, the heart beat under the influence of:",Increased sympathetic tone to SA node,Increased parasympathetic tone to SA node,Impulses generated by pacemaker tissue,Vasomotor centre,,2,
1330,CVS,By blocking both sympathetic and parasympathetic nerves to the heart the resting heart rate increases:,Remains the same,Upto 100 beats per minute,Upto 120 beats per minute,Upto 140 beats per minute,,2,
1331,CVS,The difference between the resting heart rate before and after vagotomy:,60 beats per minute,120 beats per minute,180 beats per minute,Gives a measure of the degree of vagal tone,,4,
1332,CVS,True regarding human heart:,Conduction of impulse from endocardium to inwards,During exercise durarion of systole is reduced more than diastole,Heart rate increases with parasympathetic denervation,Vagal stimulation decrease force of contraction,,3,
1333,CVS,The sympathetic thoracolumbar outflow exerts a tonic influence on almost all of the vascular system except:,Arterioles,Precapillary sphincters,Postcapillary vessels,Capillaries,,4,[Cerebral blood vessels are also not under sympathetic control.]
1334,CVS,Vessels not under sympathetic control are:,Cerebral,Splanchnic,Cardiac,Cutaneous,,1,
1335,CVS,Arteriolar dilatation is caused by all the following except:,Decrease in adrenergic discharge,Histamine,Substance P,Serotonin,,4,
1336,CVS,When spinal cord is cut at the level of T1:,The arterioles are constricted,The blood pressure falls,The sympathetic vasoconstrictors are stimulated,Quadriplegia occurs,,2,
1337,CVS,Vasodilatation of part of the vascular system can be achieved by all of the following except:,Reduction of sympathetic constrictor tone,Activation of specific vasodilator nerve,Axon reflex,Cutaneous injury,,4,
1338,CVS,Sympathetic  nerve endings where acetylcholine is the neurotransmitter are called:,Sympathetic constrictor nerves,Sympathetic cholinergic nerves,Sympathetic medullary nerves/system,Cardiac Sympathetic nerves,,2,
1339,CVS,Parasympathetic vasodilator nerves:,Best represented nervi erigentes,Gets activated only in biological emergenies,Are tonically active,Plays important role in the regulation circulation,,1,
1340,CVS,Vagal stimulation causes increase in:,Heart rate,R-R interval in ECG,Cardiac output,Force of contraction,,2,
1341,CVS,"""Axon reflex""-the arteriole:",Dilates,Constricts,Rupture,Does not show affect,,1,
1342,CVS,Substance  P is released in response to pain from:,Nerve terminals,Mast cells,Endothelium,Plasma,,1,
1343,CVS,Dilatation of arterioles may result due to:,5 - HT,Nor-epinephrine,Low temperature,Axon reflex,,4,
1344,CVS,"In axon reflex, neurotransmitter responsible to produce long lasting cutaneous arteriolar dilatation is:",Serotonin,Substance P,Acetyl choline,K+ released from the damaged cells,,2,
1345,CVS,Axon reflex is so called because:,It produces long lasting cutaneus arteriolar vasodilatation,Afferent impulse from skin are conducted via axons in orthodromic fashion to reach the spinal cord,It is a local neural response and does not involve CNS connection,It is a superificial reflex and mediated via  nerve fibers,,3,
1346,CVS,Pressor effects on CVS include all except:,Increase in cardiac output,Increase in arteriolar constriction,Increase in blood stored in venous reservoir,Increase in systemic BP,,3,
1347,CVS,Vasomotor centre:,Produce only increase in sympathetic activity,Produce only decrease in sympathetic activity,Can produce either increase or decrease in sympathetic activity,The only centre in the medulla to bring about regulation of CVS,,3,
1348,CVS,Which of the following statement about vasomotor center is true:,Independent of corticohypothalamic inputs,Influenced by baroreceptor signals but not by chemoreceptors,Acts along with cardiac vagal center (CVC) to maintain BP,Essentially silent in sleep,,3,
1349,CVS,"Inhibitory pathway in the form of vagal fibers which descent from the medulla to converge on heart, originates from the:",Dorsal motor nucleus of the vagus,Nucleus of tractus solitarious,Nucleus ambiguus,Vasomotor centre (VMC),,3,[Therefore it is also called cardiac vagal centre.
1350,CVS,The main inhibitory centre of heart is:,Nucleus tractus solitarius,Nucleus ambiguus,Nucleus parabrachialis,Dorsal nucleus of vagus,,2,
1351,CVS,"Increased pressure in the carotid sinus causes all of the following, except:",Reflex slowing of the heart rate,Increased vagal stimulation of the heart,Reflex dilatation of the peripheral blood vessels,Increased sympathetic  stimulation of the heart,,4,
1352,CVS,Sympathetic vasoconstrictor tone is  diminished in response to increased activity of:,Carotid body chemoreceptors,Carotid sinus pressoreceptors,Pain receptors,Medullary chemoreceptors,,2,
1353,CVS,Increased pressure within carotid sinus produces:,Reflex increase in venous pressure,Reflex hyperpnoea,Reflex bradycardia,Increase in heart rate,,3,
1354,CVS,"Venocostriction is exhibited by all, except:",Asphyxia,Haemorrhage,Lying down,Carotid artery occlusion,,3,
1355,CVS,Baroreceptors are not present in:,Aortic arch,Carotid sinus,Root of right subclavian artery,Descending aorta,,4,
1356,CVS,Baroreceptor reflexes act mainly through:,Sympathetic system,Parasympathetic system,Cerebral cortex,Capillary pressure,,1,
1357,CVS,Which of the following neurotransmitters are correctly matched with the baroreceptor reflexes:,GABA is released by NTS neurons projecting to VMC.,Glumatic acid is released by baroreceptor projecting directly over NTS neurons,GABA is released by baroreceptor projecting  over NTS neurons,NTS neurons which project on to interneurons release GABA,,2,
1358,CVS,Range of operation of baroreceptor is between mean BP of:,zero-60 mmHg,zero-200 mmHg,60-200 mmHg,150-200 mmHg,,3,
1359,CVS,Threshold of baroreceptor reflex is seen at mean blood pressure of:,15 mmHg,40 mmHg,60 mmHg,80-200 mmHg,,3,
1360,CVS,Blood pressure is decreased stimulation occurs in:,Carotid sinus,Pneumotaxic centre,J - receptors,Sympathetic tone,,1,
1361,CVS,Carotid sinus baroreceptor is most sensitive to:,Mean blood pressure,diastolic blood pressure,Systolic blood pressure,Pulse pressure,,1,
1362,CVS,Sino-aortic nerves are called as buffer nerves because:,They originate from vagus nerve,They innervate both baroreceptors and chemoreceptors,They buffer any alteration in blood pH,They act as BP regulators,,4,
1363,CVS,Occlusion of both carotid arteries between the heart and the carotid sinuses would be expected to produce:,Increased blood pressure as measured in the femoral artery,Decreased heart rate,Increased  activity in the afferent nerves form the carotid sinuses,Decreased activity of the vasomotor centre,,1,
1364,CVS,Clamping of the carotid arteries above the carotid sinus result in:,Increase in blood pressure and increase in heart rate,Increase in blood pressure and decrease in heart rate,Decrease in blood pressure and Increase in heart  rate,Decrease in blood pressure and decrease in heart  rate,,4,
1365,CVS,If the baroreceptor reflexes are fully functional when upright posture is assumed:,Blood vessels of arm will be vasodilated,Arterial pressure in foot maintained at 120/80 mmHg,Bradycardia occurs,Cerebral blood flow will not change appreciably,,4,
1366,CVS,Cutting the sino-aortic nerves:,Increases the activity of neurons in vasomotor centre,Decreases  the activity of neurons in vasomotor centre,Increases the activity of cardiac vagal centre,Bradycardia occurs,,1,
1367,CVS,Occlusion of common carotid artery on both sides will leads to:,Increase in HR and BP,Decrease in HR and BP,Increase in BP but decrease in HR,No effect on BP and HR,,1,
1368,CVS,All cardiac baroreceptor are innervated by:,X cranial nerve,IX crenial nerve,Sympathetic vasodilator nerve,Sympathetic cardiac nerve,,1,
1369,CVS,Basal HR is under control of:,Sympathetic nerve,parasynpathetic nerves,Vasomotor centre,Chemoreceptors,,2,
1370,CVS,Volume receptors:,Discharge onset of atrial contraction,Discharge both during atrial systolice and diastole,Provide information about circulating blood volume,Help in regulation of systemic arterial BP,,3,
1371,CVS,Volume receptors are:,Affected by total cardic output,Stimulated by atrial systole and diastole,Stimulated by left ventricular contraction,Stimulate  by aortic pressure,,1,
1372,CVS,Bainbridge reflex:,Increases the heart rate,Decreases the heart rate,Increase the heart rate  and blood pressure,Does not alter the heart rate,,1,
1373,CVS,Sudden distension of left artium in an individual produces:,Bradycardia,Hypertension,Moderate diuresis,Apnoea,,3,
1374,CVS,Atrial stretch results is:,Secretion of atrial natriuretic peptide,"Reflex vasodilatation, specially in renal circuit",Tachycardia,Hypertension,,2,This is seen secondary to increase in atrial pressure.]
1375,CVS,Partial occlusion of aorta produces all of following except:,Apnoea,Profound bradycardia,Hypotension,Hypertension due to renal ischaemia,,4,
1376,CVS,Stimulation of stretch receptors present in the left ventricle cause hypotension and bradycardia. This phenomenon is known as:,Bainbridge reflex,Bezold-jarisch reflex,Cushing reflex,Herring Breurer reflex,,2,
1377,CVS,Sudden death may occur in an individual following a massive heart attack due to activation of:,Bainbridge reflex,Cushing reflex,Bezold-jarisch reflex,Herring Breurer reflex,,3,
1378,CVS,Chemoreceptors respond to all except:,Oxygen lack,CO2 excess,Decrease blood pH,Hypertension,,4,
1379,CVS,Emotional effects on CVS are result of activation of:,Baroreceptors,Chemoreceptors,Corticohypothalamic descending pathway,Cerebral cortex,,3,
1380,CVS,Heart rate is maximum in a normal:,Foetus,Newborn,Adult,Old age,,1,
1381,CVS,A possible cause of sinus bradycardia is:,Complete heart block,Decreased sympathetic outflow,Atropine,Decreased vagal  outflow,,2,
1382,CVS,Marey's law denotes relationship between heart rate and:,Conductivity,Force of contraction,Blood volume,Blood pressure,,4,
1383,CVS,In Cushing's reflex. There is:,"Increase HR, Increase BP","Decrease HR, Increase BP","Increase HR, Decrease BP","Decrease HR, Decrease BP",,2,
1384,CVS,Increase in intracranial pressure is not associated with:,Deterioration of consciousness,Tachycardia,Respiratory depression,Increase in BP,,2,
1385,CVS,Cushing's reflex helps in maintaining:,Coronary blood flow,Cerebral blood flow,Hepatic blood flow,Skin blood flow,,2,
1386,CVS,"In brain ischaemia, systemic blood pressure rises, this is called:",Baroreceptors reflex,Cushing reflex,Bainbridge reflex,Bezold jarisch reflex,,2,
1387,CVS,Blood pressure increases and heart rate decreases in response to:,Exercise,Increased body temperature,Exposure to high altitude,Increased intracranial pressure,,4,
1388,CVS,Heart rate is slowed by the following except:,Expiration,Fear,Increased intracranial pressure,Hypoxia,,4,
1389,CVS,Heart rate is accelerated by the:,Visceral pain,Grief,Apprehension,Fear,,4,
1390,CVS,Heart rate is accelerated by the following except:,Inspiration,Grief,Exercise,Anger,,2,
1391,CVS,"Heart rate increases with inspiration, a phenomenon called:",Marey's Low,Cushing reflex,Sinus arrhythmia,Bainbridge reflex,,3,
1392,CVS,Impulses activity of the motor neurons in the nucleus ambigus depends mainly on:,Baroreceptors input,Chemoreceptors input,Corticohypothalamic descending pathway input,All of the above,,1,
1393,CVS,Resting vagal tone in a mormally breathing individual is due to:,Baroreceptors activity,Chemoreceptors activity,Cerebral cortex activity,Inspiration centre activity,,1,
1394,CVS,Average stroke volume at rest in an adult is:,40 mL,60 mL,80 mL,100 mL,,3,
1395,CVS,Cardiac output in L/min divided by heart rate equals:,Cardiac efficiency,Cardiac index,Stroke volume,Mean arterial blood pressure,,3,
1396,CVS,"Under resting conditions, the cardiac output is:",1-2 L/min,3-4 L/min,5-6 L/min,6-7 L/min,,3,
1397,CVS,Which of the following about cardiac output is correct?,Not necessarily increase with heart rate,Increases to 50L/min in exercise,Proportional to blood pressure,Proportionally falls with icrease in heart rate,,1,
1398,CVS,Cardiac index (CI) is the ratio of:,Cardiac output to body weight,Cardiac output to body surface area,Cardiac output to work of heart,Stroke volume to body surface area,,2,
1399,CVS,Cardiac index in a normal person is ‰Û_.L/m2/min:,2.1,3.2,4.6,5.9,,2,
1400,CVS,Ratio of cardiac index to cardiac output is about:,4:05,3:05,2:05,1:03,,2,
1401,CVS,What percentage of total cardiac output is distributed to the vital organs?,25%,50%,75%,100%,,3,
1402,CVS,Heart receives about:,1% of cardiac output,2% of cardiac output,5% of cardiac output,10% of cardiac output,,3,
1403,CVS,"Under resting conditions, two pumps right and left ventricles (RV and LV):",RV pumps more blood per unit time,LV pumps more blood per unit time,RV and LV both pump exactly the same quantity of blood per unit time,Connected in paraller,,3,
1404,CVS,Cardiac output is normally controlled primarily by the:,Need of the tissues for blood,Right atrial pressure,Mean systemic arterial pressure,Venous resistance,,1,
1405,CVS,Intrisic autoregulation of cardiac output is governed by:,Mean arterial pressure,Control of stroke volume,Sympathetic system,Right atrial pressure,,2,
1406,CVS,"According to Franks-Starling Law, cardiac output is increased by:",Increased end - systolic volume,Increased end - diastolic volume,Increased heart rate,Catecholamines,,2,
1407,CVS,Starlings law implies:,Increased VR  - increased cardiac output,Increased  discharge - Increased cardiac output,Increased  HR - Increased cardiac output,Increased BP - Increased cacdiac output,,1,
1408,CVS,Control of cardiac output is important to maintain:,Right ventricular (RV) output higher than left ventricular  output,LV  output higher than RV  output,Output of two ventricles to be exactly same,Normal tissue perfusion,,3,
1409,CVS,Increased venous return leads to increased cardiac output by way of the Frank-Starling mechanism. Which one of the follwing would not happen?,Increased end diastolic saromere length,Increased myocardial tension during systole,Increased stroke volume,Decreased end diastolic volume,,4,
1410,CVS,Pre-load of the heart is determined by:,End diastolic volume,Ejection systolic volume,End systolic volume,Systolic vascular resistance,,1,
1411,CVS,Homometric regulation of cardiac output is:,Independent of cardiac innervation,Primarily governed by heart rate,Independent of the resting length of cardiac muscle fibers,Governed by Frank-Starling Law of the heart,,3,
1412,CVS,Heterometric  regulation of cardiac output is:,Not dependent in the resting length of cardiac muscle fibers,Dependent on parasympathetic innervation of the heart,Dependent on sympathetic innervation of the heart,Dependent on Frank Starling Law of the heart,,4,
1413,CVS,Venous return is increased in:,Inspiration,Expiration,Coronary artery disease,Standing,,1,
1414,CVS,Cardiovascular changes that occur during inspiration include:,Decrease heart rate,Decrease right ventricular filling,Decrease right ventricular output,Increased blood returning to the heart,,4,
1415,CVS,Blood is propelled forward:,Due to diastole of the heart,Due to dilatation of arterioles,Due to various pressures,Vis-a-tergo,,4,
1416,CVS,The term 'vis-a-tergo' refers to:,Increased vanous return to the heart due to decrease in intrathoracic pressure,Force from the front to attract blood in the vein towards the heart,Propelling force on blood which drives the blood forward,Rhythmic contraction of skeletal muscles that squeezs blood out of veins towards the heart,,3,
1417,CVS,Vis-a-fronte not a true statement,Exerted by ventricular systolic suction,Exerted by ventricular diastolic suction,Is a force acting from the front to attract blood towards the heart,Force from behind,,4,
1418,CVS,In a paraplegic individual what happens to cardiac output?,Increases,Decreases,Variable,No change,,2,
1419,CVS,"With normal cardiac function, a 10 mmHg change in which of the following pressure would have the greatest effect on cardiac output?",Pressure in the carotid arteries,Pressure in the pulmonary artery,Aortic pressure,Right atrial pressure,,4,
1420,CVS,"If venous return to right atrium should increase from a normal value of about 5L/min in the adult to about 10L/min, a normal heart will most likely develop in the successive two minutes:",Decrease heart rate and very high and diastolic pressure of right ventricle,Increased atrial and end diastolic right ventricular pressure with Increased contractility,Increase in atrial and end diastolic right ventricle pressure with decreased contractility,Increase in atrial and end diastolic right ventricle pressure with increased contractility,,2,
1421,CVS,The following decrease the cardiac output except:,Sitting or standing from lying position,Rapid arrhythmias,Heart disease,High environmental temperature,,4,
1422,CVS,All of the following factors normally increase the length of the ventricular cardiac muscle fibers except:,Increased venous tome.,Increased total blood volume.,Increased negative intrathoracic pressure.,Lying-to-standing change in posture,,4,
1423,CVS,Standing to sitting change is:,Immediate increase in venous return,Increases in heart rate,Increases epinephrine,Increases cerebral blood flow,,1,
1424,CVS,All of the following factors increase cardiac output except:,Pregnancy in late stages,Histamine,Eating,Sitting from lying position,,4,
1425,CVS,All of the following factors alter the cardiac output except:,Rapid arrhythmias,Sleep,Anxiety,Exercise,,2,
1426,CVS,Cardiac output is maximally increased in:,Anxiety,After meals,Exercise,Late pregnency,,3,
1427,CVS,Increased myocardial contractility means:,Increased force of myocardial contraction,Rapid shortening of myocardial fibers,Increased ventricular performance,All of the above,,4,
1428,CVS,Single most important factor in control of automatic contractility of heart is:,Myocordial wall thickness,Right atrial volume,SA node pacemaker potential,Sympathetic stimulation,,4,
1429,CVS,Myocardiac contractility is increased by all of the following except:,Catecholamine,Tachycardia,Hypercapnia,Glucagon,,3,
1430,CVS,Myocardial contractility is decreased by:,Digitalis,Glucagon,Xanthine derivatives,Acidosis,,4,
1431,CVS,Intrinsic  Myocardial depressant decreases the Myocardial contractility  by:,Causing part of myocardium to become fibrotic,Decrease cAMP  formation in myocardium,Increasing breakdown of cAMP in myocardium,Decreasing catecholamine content of myocardium,,4,
1432,CVS,The cause of post extrasystolic potentiation is:,Ca2+,K+,Na+,Mg2+,,1,
1433,CVS,Digitalis increases myocardial contractility by:,Inhibiting N+-K+ ATPase in the myocardium,Decreasing breakdown of cAMP,Increasing formation of cAMP,Activating proteinkinase,,1,
1434,CVS,Most accurate cummonly method employed for measurement of cardiac output is:,Direct fick method,Dye dilution method,Echocardiography,Thermodilution method,,3,
1435,CVS,Direct fick method of measuring cardiac output require estimation of all except:,O2 content of arterial blood,O2 consumption per unit time,O2 content of blood from right ventricle,O2 content in inferior vena cava,,4,
1436,CVS,If O2 absorbed by the lungs is 200 mL/min  and arteriovenous O2 difference is 4 mL/dL then using Fick's method cardiac output is :,3.5 L/min,4 L/min,5 L/min,6 L/min,,3,
1437,CVS,"During exercise, a man consume 1.5 L of oxygen per minute. His arterial O2 content is 19mL/dL and that of mixed venous blood is 9 mL/dL. His cardiac output is about:",5 L/min,10 L/min,15 L/min,20 L/min,,1,
1438,CVS,"To estimate cardiac output by dye-dilution technique, dye concentration is measurred in:",Sample from peripheral artery,Sample from right atrium,Sample from aorta,Sample from pulmonary artery continuously,,1,
1439,CVS,"In dye dilution method , the average normal duration of 1st passage of dye through an artery is:",5 sec,10 sec,20 sec,40 sec,,4,
1440,CVS,"In echocardiaograpy, pulses of ultrasonic waves are enitted at a frequency of:",1 mega hertz,2 mega hertz,20 hertz,2000  hertz,,2,
1441,CVS,The cardiac output can be determined by all except:,Fick's principle,Ventilation perfusion ratio,Echocardiography,Thermodilution,,2,
