S.No,System,Question,1,2,3,4,,Ans,Explanation
2585,Renal System,Metabolic alkalosis associated with prolonged vomiting is primarily due to loss of:,Sodium,Potassium,Chloride,Hydrogen ion,,4,
2586,Renal System,In which of the following metabolic alkalosis is not seen:,Excessive renal reabsorption of HCO-3,Severe diarrhoea,Persistant vomiting,Lactate overtreatment,,2,
2587,Renal System,Metabolic alkalosis is seen in all except::,Over treatment with lactate,Severe diarrhoea,Prolonged vomiting,Antacid therapy,,2,
2588,Renal System,A patient  has a plasma HCO3- concentration of 25 mEq/L and pCO2 of 50 mmHg He has:,Compensated metabolic acidosis,Compensated respiratory alkalosis,Respiratory acidosis,Respiratory alkalosis and metabolic acidosis,,3,
2589,Renal System,Most important renal defence against respiratory alkalosis is:,Increased excretion of HCO3-,Increased excretion of H+,Decreased excretion of ammonia,Increased secretion of K+,,1,
2590,Renal System,Increase in the alveolar ventilation increase rhe blood pH because:,It makes haemoglobin a stronger acid,It increases the pO2 of the blood,It decreases the pCO2 in the alveoli,It activates neural mechanism that remove acid from the blood.,,3,
2591,Renal System,What happens to renal H+ secretion in respiratory alkalosis?,Decreased,Increased,Unchanged,Variable,,1,
2592,Renal System,In uncompensated respiratory acidosis:,Plasma pH change is always greater compared to uncompensated metaboic acidosis,There are no compensation mechanisms,involves changes in plasma [HCO-3],is associated with a change in pCO2,,4,
2593,Renal System,"In metabolic alkalosis, the compensation is by:",Decreased in ventilation,Increased renal HCO3- excretion,(a) and (b) both,Prolonged vomiting,,3,
2594,Renal System,Renal compensation for metabolic acidosis involves all of the following except:,Increased tubular secretion of hydrogen ions,Activation of the tubular ammonia buffer system,Increased filtration of bicarbonate ions,Increased excretion of hydrogen ions in the urine,,3,
2595,Renal System,Anion gap is mainly due to:,Sulphates,Phosphate,Proteins,Nitrates,,3,
2596,Renal System,Normal anion gap metabolic acidosis is seen in:,Diarrhoea,Renal failure,Lactic acidosis,Diabetic ketaacidosis,,1,
2597,Renal System,Pale lemon yellow colour of the urine is due to all except:,Urochrome,Urobilin,Uroerythrin,Urobilinogen,,2,
2598,Renal System,Which of the following is normally not excreted in urine?,Uric Acid,Chloride ion,Glucose,Creatinine,,3,
2599,Renal System,Which of the following is minimally excreted in urine?,Urea,Creatinine,Uric acid,Phosphate,,3,
2600,Renal System,Renal failure may be associated with:,Oliguria,Polyuria,Anuria,Any of the above,,4,
2601,Renal System,Not true of obligatory  urine volume:,Less than 400 ml/day,Also called oliguria,Seen in terminal of renal failure,Its specific gravity is 1001,,4,
2602,Renal System,Specific gravity (SG) with maximum diluted and concentrated urine respectively is:,1001; 1040,1010; 1020,1020; 1030,1030; 1040,,1,
2603,Renal System,False statement with reference to specific gravity of urine:,Inversely proportional to quantity of urine,Increases in kidney damage,Affected by number of osmotically active particles,In renal failure it become fixed and low despite variation in water  intake,,2,
2604,Renal System,Isothenuria is:,Low fixed specific gravity of urine (1010) despite variation in water intake,Dilute urine of specific gravity (1001),Concentrated urine of specific gravity (1040),Seen in early stages of diabetes mellitus,,1,
2605,Renal System,Normal reaction of urine is:,Slightly acidic,Average pH is 6-6.5,Becomes alkaline after meals,Neutral pH,,4,
2606,Renal System,Urine normally contains all of the following except:,1-2 pup cell/HPF,Hyaline casts,Granular casts,Non-squamous epithelial cells,,3,
2607,Renal System,Not true of urinary hyaline casts:,Presence is abnormal,They are non-squamous epithelial tubular cells,"They are clear, colourless casts of renal tubules",Seen as small cylinders with rounded ends,,1,
2608,Renal System,Presence of which of the following in urine is normal:,Granular casts,Glucose,Albumin,Protein upto 50 mg/day,,4,
2609,Renal System,Granular casts in urine:,Are regarded as normal,Are hyline casts embedded with RBCs,Made up of mucoprotein substances,Formed in the DCT,,2,
2610,Renal System,Excretion of proteins in urine upto‰Û_.... Mg/day is regarded as normal:,50-100,150-250,250-500,Zero,,1,
2611,Renal System,Useful index to assess function of glomerular filtration are all except:,Blood urea,Serum creatinine,Filtration fraction,PAH estimation,,4,
2612,Renal System,Test to assess renal tubular function include all except:,PAH clearance,Urea clearance,Intravenous pyelography (IVP),Measurement of water reabsorption,,3,
2613,Renal System,Not a true statement about urea clearance:,Measure the rate of excretion of waste products,"Obsolete test, not used clinically",Normal standard urea clearance is 54 ml/min,"When rate of urine flow is below 2ml/min, excretion of urea is miximal",,4,
2614,Renal System,"In water dilution test for tubular function, the patient can excrete at least‰Û_..% of volume ingested within 5 hours:",40,50,70,90,,3,
2615,Renal System,Withdrawal of fluids for 12-18 hours indicates kidney concentration power is normal if specific gravity of urine is:,1001 to 1007,1008 to 1010,1010 to 1020,Above  1020,,4,
2616,Renal System,Part of urinary bladder mainly responsible for its emptying during micturition:,Detrusor muscle of body,trigone,Internal sphincter,External sphincter,,1,
2617,Renal System,In infant the physiological capacity of urinary bladder is:,20-50 ml,50-100 ml,100-150 ml,150-200ml,,1,
2618,Renal System,"During first years of life, urinary bladder physiological capacity is increased by ‰Û_.times:",2,3,4,5,,3,
2619,Renal System,The difference between physiological and anatomical capacity of urinary bladder in adult is ‰Û_..ml:,200,300,400,Zero,,3,
2620,Renal System,False statement regarding urinary bladder capacity:,Physiological capacity is less than anatomical capacity,Anatomical capacity is never approached under physiological conditions,Anatomical capacity is the capacity just before bladder ruptures,It is less in females,,4,
2621,Renal System,Sympathetic nerve innervate all of the following parts of urinary bladder except:,The body,trigone,Internal sphincter,External sphincter,,4,
2622,Renal System,Emptying of urinary bladder is a function of:,Sympathetic innervation,Parasympathetic innervation,Somatic innervation,Pudendal nerve,,1,
2623,Renal System,Pudendal (pudic) nerve controls:,External sphincter of rectum,External sphincter of urinary bladder,Size in pupil,Gastroesophageal reflex,,2,
2624,Renal System,Filling of urinary bladder upto 300-400 ml fluid increases the intravesicle pressure to:,10 cm H2O,30 cm H2O,50 cm H2O,Above 100 cm H2O,,1,
2625,Renal System,"In micturition reflex, the first change to occur is:",Trigone relaxation,Detrusor contraction,Relaxation of perineal muscles,Decreased urethral pressure,,3,
2626,Renal System,The moderate filling of urinary bladder results in small increase in intravesicle pressure upto 10 cm H2O only due to all of the following except:,Instrinsic tone of urinary bladder,Operation of law of Laplace,"The tension increases as the organ fills, but so does the radius",Parasympathetic innervation,,4,
2627,Renal System,ureteric peristalsis is due to:,Sympathetic innervation,Parasympathetic innervation,Both (a) and (b),Pacemake activity of smooth muscle cells in renal pelvis,,4,
2628,Renal System,Micturition waves false statement is:,Iniitiated by stretch receptors in the urinary bladder,Are periodic acute rise in intravesicle pressure duing filling the bladder,Are superimposed on the tonic pressure changes,Occurs when intravesicle pressure rises above 100 H2O,,4,
2629,Renal System,Not a component of micturition reflex:,Stretch receptors in the bladder wall,"Dorsal nerve root S2,3,4",Parasympathetic efferent nerve,Sympathetic efferent nerve,,4,
2630,Renal System,False statement with reference to micturition reflex:,Initiated  at a urinary bladder volume of approx. 150 ml,Has a fixed threshold,Can be inhibited or facilitated  by centres in the brain stem,"Cannot be inhibited, once intravesicle pressure rises above 100 cm H2O",,2,
2631,Renal System,Facilitatory and inhibitory areas for micturition reflex are mainly located in the:,Medulla,Pons,Midbrain,Brain stem,,4,
2632,Renal System,Amount of urine left in the urinay bladder at the end of micturition is ‰Û_..ml:,50,100,150,Zero,,4,
2633,Renal System,The first urge to pass urine is felt at a urinary bladder volume of about ‰Û_ml:,50,100,150,250,,1,
2634,Renal System,"In a normal adult, the sense of fullness or discomfort is felt when urinary bladder volume is about ‰Û_.ml",200,400,600,800,,2,
2635,Renal System,In young children micturition is:,Controlled by higher centres,A spinal reflex,Voluntarily  controlled,A perfectly controlled activity,,2,
2636,Renal System,Postural activity of urinary bladder can be influenced by all except:,Emotional stress,Cystitis,Enuresis,Rest,,4,
2637,Renal System,Residual urine is:,Urine left in the urinary bladder after micturition,A normal phenomenon,Never seen with urinary bladder dysfunction,A common finding of examination anxiety,,1,
2638,Renal System,Deafferentation of urinary bladder is characterized by all except?,Voluntary micturition not possible,Person unaware of state of distension of bladder,Automatic bladder,Residual urine,,1,
2639,Renal System,Automatic bladder is seen in:,Spinal shock,Cauda equina lesion,Tabes dorsalis,Denervation,,3,
2640,Renal System,Denervation of urinary bladder may result in all of the following except:,Complete loss of voluntary micturition,Isolated bladder,Insufficient emptying,Automatic bladder,,4,
2641,Renal System,"In early stage of spinal shock, type of micturition not seen is:",Passive incontinence,Overflow incontinence,Retention with overflow,Mass reflex,,4,
2642,Renal System,Repeated infection of urinary bladder may lead to:,Flaccid distended and unresponsive bladder,Retention with overflow,Isolated bladder,Spastic neurogenic bladder,,4,
2643,Renal System,Spastic neurogenic bladder is:,Which contracts automatically as it fills up,"Contracted, thin walled and hypotonic",Which contracts at erregular intervals even with small amount of urine,Which when full causes escape of small amount of urine at frequent intervals,,3,
2644,Integrated Physiology,Human beings are:,Poikilothermic,Homeothermic,(a) and (b) both,Cold blooded animals,,2,
2645,Integrated Physiology,False about neutral (or comfortable) zone temperature is:,Ambient temperature at which no active  temperature regulatory mechanism operates,Normal is 27 +  2å¡C,Also called critical air temperature,Oral temperature of an individual,,4,
2646,Integrated Physiology,Regulation of body temperature is required:,To obtain neutral zone temperature,To speed up chemical reactions within the body,Because enzyme system of body has narrow temperature range to function,To prevent body invasion by bacteria,,3,
2647,Integrated Physiology,To convert å¡C to å¡F:,Multiply by 9/5 and substract 32,Multiply by 5/9 and substract 32,Subtract 32 and multiply by 5/9,Multiply by 9/5 and add 32,,4,
2648,Integrated Physiology,Oral temperature:,An accurate index of body temperature,Remains fairly constant under different conditions,Closely correlated with rise of temperature in subclavian artery,Thermoregulatory receptors are sensitive to it,,3,
2649,Integrated Physiology,"Core temperature, false statement is:",Also called internal body temperature,Hypothalamic thermoregulatory  receptors are sensitive to it,Changes least with changes in environmental temperature,Shows wide variation during day to day activity,,4,
2650,Integrated Physiology,Sites which reflects the true value of core temperature are all except:,Oesophagus and rectum,Tympanic membrane,Vagina,Mouth,,4,
2651,Integrated Physiology,False about body temperature in a normal healthy person:,Average oral temperature is 37å¡C,Diurnal variation upto 0.5å¡C may occur,Maximum reading in the early morning,Rectal temperature is 0.5-1å¡C more than oral temperature,,3,
2652,Integrated Physiology,Lower and upper lethal core temperatures respectively are:,5å¡C below and above the normal,7å¡C below and above the normal,26å¡C and 43.5å¡C,30å¡C and 41å¡C,,3,
2653,Integrated Physiology,Core temperatur of 26å¡C leads to death due to:,Brain damage,Respiratory insufficiency,Cardiac failure,Renal damage,,3,
2654,Integrated Physiology,Rectal temperature is higher than oral temperature by‰Û_...å¡C:,0.5-1,01-Feb,02-Mar,03-Apr,,1,
2655,Integrated Physiology,Infact' core temperature is generally more by 0.5å¡C than adults' normal not due to:,Irregular activites,Brown fat,Thermoregulatory mechanisms are not fully  developed,Higher resting HR,,4,
2656,Integrated Physiology,In old age internal body temperature is ‰Û_..the established norms:,Same,Below,Above,Variable,,2,
2657,Integrated Physiology,Normal body temperature can be raised by:,Androgens,Gonadotrophins,Oestrogen,Progesterone,,4,
2658,Integrated Physiology,Circadial fluctuation in body temperature may occur in healthy individuals upto‰Û_.å¡C:,0.5,1.5,2,Not-seen,,2,
2659,Integrated Physiology,"During severe exercise, core temperature may rise by ‰Û_...å¡C:",03-Apr,04-May,05-Jun,06-Jul,,1,
2660,Integrated Physiology,A major factor resulting in increase in body temperature during exercise is:,Heat dissipating mechanisms inefficient,Enormous thermogenesis,Vasoconstriction in non-working muscles,Resetting of thermostat,,4,
2661,Integrated Physiology,Not a cause of thermogenesis in the body:,Skeletal muscles contraction,Assimilation of food,Decreased cardiac metabolism,Thyroxine,,3,
2662,Integrated Physiology,"A person who is under complete physical and mental rest, the various forms of energy are converted into:",Pressure energy,Kinetic energy of circulation,Heat,Energy required for digestion and absorption,,3,
2663,Integrated Physiology,"In the clinical determination of BMR it is necessary according to common practice, to measure the patient's",Surface area,Lean body mass,Specific gravity,Height and weight,,4,
2664,Integrated Physiology,BMR is dependent on:,Body weight,Body surface area,Amount of adipose tissue,Amount of lean body mass,,2,
2665,Integrated Physiology,BMR can be estimated by all except:,By measuring person's total heat production over a certain period,From total food consumption provided RQ is known,From oxygen consumption provided RQ is known,From CO2 production if RQ is known,,2,
2666,Integrated Physiology,A major source of production in infants is:,Increased musclar activity,Brown fat,Increased sympathetic activity,Specific dynamic action of food,,2,
2667,Integrated Physiology,How many Kcals are required by a person weighing 70 Kg to raise his body temperature by 1å¡C?,7,14,28,56,,4,
2668,Integrated Physiology,Heat is lost from the body by all except:,Radiation,Conduction,Convection,Curling up,,4,
2669,Integrated Physiology,At normal room temperature most body heat loss is by:,Convention,Conduction,Radiation,Sweating,,3,
2670,Integrated Physiology,Under physiological condition heat acclimatization is accomplished by all except:,Decreased renal blood flow,Increased urine sodium,Increased aldosterone secretion,Excessive sweating,,2,
2671,Integrated Physiology,At environmental temperature of 36å¡C most important  mechanism of heat loss is by:,Sweating,Radiation,Conduction,Insensible perspiration,,2,
2672,Integrated Physiology,The only available mechanism of heat transfer when the environmental temperature is greater than the body temperature is?,Radiation,Conduction,Convection,Evaporation,,4,
2673,Integrated Physiology,About ‰Û_..% of heat is lost by evaporation from body including lungs:,10,20,30,40,,3,
2674,Integrated Physiology,"Normally, insensible water loss (perspiration) through skin per day is:",400-600 ml,600-800 ml,800-1000 ml,1000-1200 ml,,4,
2675,Integrated Physiology,Vaporization of 1 gm (about 1 ml) of water removes approx ‰Û_..of heat:,200 calories,400 calories,600 calories,800 calories,,3,This is equal to 0.6 Kcal]
2676,Integrated Physiology,Heat loss process of the body not direclty under physiological control is;,Radiation from body,Conduction and convection surroundings,Vaporization of sweat,Warming of inspired air,,4,
2677,Integrated Physiology,Insensible water loss (perspiration) will be absent if humidity is:,50%,70%,90%,100%,,4,
2678,Integrated Physiology,Constituents of secreted sweat are similar to plasma except for:,Proteins,Chloride,Bicarbonate,Potassium,,1,
2679,Integrated Physiology,Thermal sweating differs from non-thermal sweating in all of following except:,Eccrine gland are responsible for it,Occurs due to activation of sympathetic cholinergic nerves,"Found mainly over palm, sole and axilla",Apocrine glands are responsible for it,,4,
2680,Integrated Physiology,The hormones associated with cold adaptation is:,Growth hormone,Thyroxine,Insulin,Melanocyte stimulation hormone,,2,
2681,Integrated Physiology,Sweating as a result of excretion is mediated through:,Adrenal hormones,Sympathetic cholinergic,Sympathetic adrenergic,Parasympathetic cholinergic,,2,
2682,Integrated Physiology,"In an unacclimatised person suddenly exposed to cold atmosphere, changes seen are:",Increase in systolic  blood pressure,Shift of blood from shell to core,Non-thermogenic shivering,Tachycardia,,2,
2683,Integrated Physiology,One feels hotter on a humid day because:,Rate of sweating increases,Surrounding temperature is more,Heat loss by the body via process of radiation decreases,Rate of evaporation of water from body decreases,,4,
2684,Integrated Physiology,Body temperature will rise sharply  when exposed in an atmosphere of:,"Over 100å¡C, dry air","50å¡C, damp air","25å¡C, dry air","25å¡C, damp air",,2,
2685,Integrated Physiology,"When an individual is naked in a room in which the air temperature is 21å¡C (69.8å¡F) and humidity 80%, the greatest amount of heat is lost from the body by:",Respiration,Vaporization of sweat,Radiation  and conduction,Elevated metabolism,,3,
2686,Integrated Physiology,Shivering can increase the rate of heat production upto ‰Û_.times:,2,3,5,8,,2,
2687,Integrated Physiology,"During exposure to cold, body temperature is raised by all except:",Vasoconstriction in the skin,Horripilation,Thermogenesis,Perspiration,,4,
2688,Integrated Physiology,When the core temperature of the body falls below the hypothalamic set-point temperature not seen in:,The blood vessels of the skin constrict,Heat production increase within minutes,The basal metabolic rate increases,Thermal shivering,,4,
2689,Integrated Physiology,True about non-shivering thermogenesis:,Glucose converted to lactate,Fatty acids show uncoupled oxidative phosphorylation,ADP is burnt with heat,Adipose tissue is entirely absent,,2,
2690,Integrated Physiology,Non-shivering thermogenesis in adults is due to:,Thyroid hormone,Brown fat between the shoulders,Noradrenaline,Muscle metabolism,,3,
2691,Integrated Physiology,A 10 degree decrease in temperature causes decrease in cerebral metabolic rate by:,10%,30%,50%,70%,,4,
2692,Integrated Physiology,A person who has been cold acclimatized shows all changes except:,Hypothermic response,Increased vascular insulation,Initiation of shivering at lower temperature,Decreased metabolism,,4,
2693,Integrated Physiology,False statement regarding horripilation:,Seen during exposure to cold,Activation by anterior hypothalamus,Result in goose pimple,Increase the thickness of the trapped air,,2,
2694,Integrated Physiology,"In human being, the least useful physiological response to low environmental temperature is:",Shivering,Vasoconstriction,Release of thyroxine,Pilocerection,,4,
2695,Integrated Physiology,Integration of temperature information by the nervous system occurs mainly in the:,Spinal cord,Hypothalamus,Amygdala,Peripheral receptors,,2,
2696,Integrated Physiology,Single that activates the hypothalamic temperature regulating centres comes from all of the following except:,Thermoreceptors in anterior hypothalamus,Cutaneous temperature receptors,Cold receptors in the skin,Proprioceptors,,4,
2697,Integrated Physiology,"In damage, to preoptic area in hypothalamus, What is seen‰Û_......:",Hypothermia,Hyperthermia,Loss of appetide,Increased appetide,,2,
2698,Integrated Physiology,Which area of hypothalamus functions as thermostat?,Preoptic,Paraventricular,Dorso medial,Lateral,,1,
2699,Integrated Physiology,Physiological compensation seen in a heat acclimatized person are all except:,More secretion of catecholamine,More secretion of aldosterone,More secretion of thyroxin,Fall in metabolising,,2,
2700,Integrated Physiology,The first physiological response to high environmental temperature is:,Sweating,Vasodilation,Decrease heart production,Not-shivering thermogensis,,2,
2701,Integrated Physiology,"During the course of febrile illness, shivering is usually associated with which of the following?",A recent increase in the hypothalamic set point temperature,A recent reduction in the hypothalamic set point temperature,Rising body temperature,Falling body temperature,,1,
2702,Integrated Physiology,Pyrogens raise body temperature by:,Setting the thermostat to higher level,Releasing interleukins,Decreasing peripheral heart liberating mechanism,Causing peripheral vasoconstriction,,2,
2703,Integrated Physiology,Fever is usually caused by;,Interleukins I,Substance P,Endorphins,Encephalin,,1,
2704,Integrated Physiology,What is the mechanism by which infection causes fever?,Increased heat production and decreased heat loss,Decreased heat production and decreased heat loss,Pyrogens acting independent of hypothalamus,Release of Endotoxin from bateria,,4,
2705,Integrated Physiology,Aspirin decreases the body temperature by:,Inhibiting interleukin -1,Inhibiting pyrogens release,Killing fever production organisms,Inhibiting prostaglandin synthesis,,4,
2706,Integrated Physiology,Profound hypothermic signs include all except:,Slow breathing,Bradycardia,Hypotension,Hyperactivity,,4,
2707,Integrated Physiology,Humans can tolerate body temperature of‰Û_....without permanent ill-effects:,26å¡C and 41å¡C,21å¡C and 24å¡C,16å¡C and 20å¡C,41å¡C and 45å¡C,,2,
2708,Integrated Physiology,Catabolic processes liberate energy because of all of the following except:,Energy content of complex foodstuff is greater than that of its simple products,Bond energy is liberated when the bonds are broken,Energy of formation of the chemical bonds,Building up of storage materials,,4,This is anabolism
2709,Integrated Physiology,Phase I of catabolism corresponds to:,Liberation of about 1/3rd of the available energy,Oxidation of a product to from CO2 abd H2O,Processes of intestinal digestion and absorption of a product,Citric acid cycle,,3,
2710,Integrated Physiology,A major portion of energy by catabolism of a foodstuff is released during:,Process of intestinal digestioin and absorption,Its oxidation to CO2 and H2O,Final stage of metabolism,Its mobilization for storage in tissues,,3,
2711,Integrated Physiology,Unit of energy are all except:,Is the same as that of heat,Is calorie,Commonaly used in term medicine is kilo-calorie,Is kpa,,4,
2712,Integrated Physiology,Low energy phosphate compound when hydrolysed liberate approx‰Û_..Kcal/mol.as heat:,02-Mar,10-Dec,15-20,25-30,,1,
2713,Integrated Physiology,Not a  high energy phosphate is:,ATP,Creatinine phosphate,ADP,Glucose -6 -phosphate,,4,
2714,Integrated Physiology,Which of the following is a high energy compound?,ANP,ATP,UTP,GTP,,2,
2715,Integrated Physiology,Which of the following produces the most high energy phosphate compounds?,Aerobic metabolism of 1 molecule of glucose,Anaerobic metabolism of 1 molecule of glucose,Metabolism of 1 molecule of long chain fatty acid,Metabolism of 1 molecule of amino acid,,3,
2716,Integrated Physiology,Not a true of high energy phosphate compound:,Liberate 10-12 kcal/mol on hydrolysis,Example include creatine phos-phate ADP and ATP,Is the sole source of energy that cells can use directly,The release energy is not wasted as heat,,4,
2717,Integrated Physiology,One mole of ATP on conversion to AMP releases ‰Û_....calories,1000-1200,2000-2400,3000-3600,4000-4800,,1,
2718,Integrated Physiology,False for the co-factor (or-co-enzyme):,It is a simple ion e.g. Mg2+ or PO43-,It is a complex  organic but non-protein substance,Less specific,It cannot be used again.,,4,
2719,Integrated Physiology,Enzyme which catalyses the trasnfer of H+ atoms to NAD is knows as:,Co-enzyme,Dehydrogenase,Cytochrome oxidase,Flavoprotein,,2,
2720,Integrated Physiology,Not an example of biological dehydration genation include:,Oxidation of lactic acid to pyruvic acid,Oxidation of phosphoglyceraldehyde to phosphoglyceric acid,Oxidation decarboxylation of pyruvic acid,Gain of electron,,4,This is reduction
2721,Integrated Physiology,Oxidative phosphorylation is defined as:,Transfer of H+ to approriate coenzyme acceptor,"Oxidation of lactic acid to pyruvic acid, when NAD and hydrogen carrier",Electons moves form H+ atom and transferred to O2 with release of excess energy used to convert ADP to ATP,Oxidative decarboxylation of pyruvic acid,,3,
2722,Integrated Physiology,Cells with decreased oxidative phosphorylation have:,Increased ribosomes,Decreased mitochondia,Low protein,No motility,,2,
2723,Integrated Physiology,Not true of flavoprotein-cytochrome system:,A chain of enzymes that transfer oxygen to hydrogen,It operates in the mitochondia,Oxidation by this system is called oxidative phosphorylation,Results in production of ATP,,1,
